i get colour fringing on unedited videos which i played straight from sd memory card. after i convert the video, there is no colour fringing problem at all. i dont know weather it is a bad point or not but just wanted to mention.
nothing wrong with the camera to date. the touch screen will need regular cleaning for live view. it is also the main centre for changing settings so it  means the lcd display is generally on. not sure what effect this will have on battery life in practice
lens autofocus noisy on video (not that i use it)
nothing stands out as a bad point on this camera that any other wouldn't have.
unable to use the view finder to take video, which would make framing easier and more accurate in bright sunlight because like all lcds they can be difficult to see at times, despite maximum light adjustment. lcd ok in less bright sunlight.
canon said they would send 4 dvds to help get me started! they sent one and it didn't teach me a thing, it just said what i could learn on their courses! grrrr! nice camera though!
not over keen on the live view....seems to a little cumbersome
only recently bought camera but to date have not found any bad points.
face recognition and tracking is only available using 'live view' with lcd screen and not through viewfinder but this is a minor issue.
auto focus when filing is a little noisy
may not be that much of an improvement over 550d/600d to warrant extra cost
long users manual with needed information to go through
video wb function is cumbersome; video button could do with a separate release cable to avoid camera movement
plastic
no zoom view on screen and screen could possibly be a little more robust, but time will tell.
expensive! but can't complain with 0% finance!
not come across any!
small buttons
complicated to use!!
difficult to print out at 380 pages long
no bad points
this can affect you if you are a video maker.
not found any
i would recommend that you purchase a supplementary book on how to get the best out of your canon 650d, its only been two weeks since the arrival of the camera and there is a lot to learn
auto focus by making movie
2) buttons can be easily bumped/pressed when your face is all up in the camera
night shooting
livraison trop long j'ai attendu 1 mois.
how about no
focus can be a bit slow in low contrast situations
nothing - this camera is brilliant.
does not feel as robust as it probably is
haven't found any as yet
feels a little plasticky, too many picture taking options on top dial (if you can have too many).
no lens hood as standard.
nit spoted any as yet
kit lens has a plasticky feel
lack of built in filter thread.
loss of variable screen over earlier models, but understand the compromises made.
parallax error through the view finder
menu's can be tricky to navigate without the manual
view finder dont show any information
a disadvantage of the fast lens is that it is reluctant to use flash when i want it to, but i will just have to play with the settings.  the box included a cd with a manual, but only in chinese!  however it is easy enough to find the pdf on the internet.
not compatible with other g series components
manual flash keeps catching me out as my g9 flash was auto.
grip good be better not much to hold on to, still it is a compact
still expensive. got mine cheaper as next model just out but it was a stretch
colour balance in certain artificial light situations could be easier to get right. sometimes menus not intuitive. no sd card provided.
not had it long enough to find any yet.
if you want a point and shoot camera don't bother. this can do that but you will miss the opportunity to take control and be creative.
can't think of any
the movie frame rate should be switchable between 25fps uk system to 30fps american system
you have a buy a separate book as no manual but no big deal bought an excellent guide for \xa315
not as good as the g12 because it does not have the directional viewing screen.
it was delivered with out a paper manual! im sure its a very good camera but its difficult to figure out with out a paper manual.
as above
even if this compact is the best i found, still the quality of the pictures are far from slr (d800)
non
haven't found anything yet. only small point is that the charging plug on my camera is a bit micky mouse. it comes as a multi plug option which i think may be because the camera isnt from uk stock.
fiddly controls
does not include a wrist strap.
poor optical viewfinder
optical viewfinder.
-
quite heavy.
no hard copy manual
haven't really found any yet - sorry, but it's just a fab happy snapper.
the elv only extends through the optical zoom range.  initially, i found  the menu complicated ( i'm a slow learner ) but i'm learning. the auto and p settings are excellent if needed.
perhaps a little on the heavy side for a compact camera but that is a very minor complaint.
price
no information in oprtical viewfinder gives this limited value and i haven't used it as much as i expected - perhaps an evf would be better in the next model.
i have not yet discovered any
don\xb4t know yet but the cover for lens seems pretty thin so carry case would be recommended to protect cover from taking hits.
no paper manual - it is hopeless to have to consult the computer every time you want to check how to do something.  this is a big minus.00
fairly bulky.  not a particularly long zoom.
view finder is vital for me, so better if at least some information is shown in it.
no printed manual
only drawback is power button...... it sits exactly where i rest my index finger when not shooting..... inconvenient but manageable.
5 x zoom against the previous g9 i owned which had 6 x
pushing it into a tight pocket can accidentally rotate some of the dials on top, so when you pull it out to take a quick shot expecting it to be on  'auto' it may be on portrait, and the exposure compensation on +2 for example.  not a major issue, but check before you shoot.
manual focus point
view finder too small should be rectangular.
big
internal flash seems a little weak/underpowered.
heavy
having so many dials and modes takes getting used to before being able to use the camera effectively.
le viseur , pas de porte filtre sur l'objectif
no manual only a cd very frustrating to a new photographer
we heard something and difficult to get out
lack of functions in video mode, lens noise when zooming in video mode, no microphone input
manual centre spot focusing still difficult to master/use
expensive, but compares well with other cameras in this range.
still just looks like an entry level dslr. still tying to figure out if it can do single point af.
objectif cher + bruit du declencheur pas tjr discret
hi,why mmy canon eos 650 d have 10 digit serial number,rest cameras canon 650 d have 12 digit serial number.please answer for my question.this is fake?
body's is a fair bit larger bare that in mind (bags are a pain). touch screen feature is great but smudges really easily. carry around a screen wipe. also difficult to see in bright sunlight due to glare.
not particularly robust
not found any yet
this particular kit does not have the image stabilised lens (which is why it is a bit cheaper)
but i suppose some economies needed to be made to keep price down. the instruction manual is printed in very small type face and is not the easiest manual i have ever read, however there are pleanty of online tutorials.
cant think of any
night shots are good , wont say excellent.
camera is bulky, however, i knew this when i purchased it! i also felt a little intimidated with all it's buttons etc, however, i brought myself a dummies guide to eos 1100d. lastly, again this is no fault to the camera directly, however, be warned once you buy a product of this kind you do end up buying 'extras' battery, sd card, which all adds up!
sporty photo shoots can't be done properly with this. although shutter speed is good but motion detection is not that much good. hence photo becomes blurry. night potrait system has same problem.
lens has some silver strip between the moving parts which is peeling loose. had to superglue that badboy back in! also, sometimes trouble with auto-focusing in very low light.
only 720p video.
not found any yet
looking at the design, i'm sure canon could have made the lcd screen larger. these are only niggles!!
no bad points, apart from its an older model might have a few difficulties selling it off later on when upgrading to another model
can't think of any.
makes you want to spendall your cash on lenses
i will have to buy a lens cap that i can attach to the camera as the lens cap on this camera doesn't have a string attachment and i keep dropping it from force of habit! that is the only drawback i have come across!
has a plasticy feel but doesn't distract from use.
i would like a carrying case to come with it.
quite heavy
auto focus sometimes doesn't work properly
the lcd screen is a tiny bit on the small side.
no bad points just yet!
would prefer if the lens cap was attached to the camera as it has been misplaced on more than one occasion.
you can get some cheap lens of ebay to get you started like i did
quite a light weight build.
autofocus in liveview, battery...... :(
the features are great so it is a bit pointless if you only intend to use the auto function.
compared to the more expensive canons it feels a little bit plastic, but not to bad
no comment.
no carry case
n-o-n-e
no bad points about this product.
battery charge could be better.
struggling to find any apart from lack of full hd video, but if like me you are happy to live without it a very good buy
unable to change colours on the camera itself (eg, to black and white).
haven't found any yet.
cant reduce pixels at camera level
limited zoom means having to buy additional lense straight away
the shutter is loud, not an issue for most things but can be for wildlife shots.
objectif trop limit\xe9
fault after 4 - 5 days unable to resolve
hard to find protective bag to put camera in.
interface isn't overly intuitive. going 'back' for instance within a menu isn't easy..
don't like smooth finish could be made to look more leather like
haven't found any yet
no camera case
for the price
memory card included
can't find any till this moment.
change between single and multi shot is a bit slow
see above!
where i bought it from
only 12 megapixels, but the pictures still look good, but haven't printed any yet though
it is hard to turn on some features. the menu takes a while to get used to and is not totally intuitive at times.
daunting amount of indicators on display if trying out manual operations.  feels a bit weighty.  can be a bit noisy when taking a shot (clacking sound) particularly when in a theatre!
i haven't really found anything i'd identify as a 'bad point', although i accept what some reviewers have said about the camera maybe feeling a little 'plasticky' (sic0 in build.  but so far that hasn't worried me.
havent found any yet
the kit lens is good for the initial pics but soon you'll be after a 'proper' one! consider buying wihout any lens and buying a better one from the outset.
non i have found up to now.
noe
transfer of video to computer, some files get corrupted. visual then judders and stalls on playback whilst sound is unhindered. however this is not on all transfers.
flash is broken
so many features it's impossible to remember all of them
connecting to wifi is cumbersome
possibly a bit too small and battery life isnt too impressive.
following instructions as to how to utilise wifi -  still not mastered it
2) if you want to embed gps data into your photos and video then you need to have your smart phone with you and remember to activate the app before you take your shot which is ridiculous.
a lot of functions to learn (but that's not that bad
the position of the pop-up flash is irritating! it's right where the fingers of your left hand rest.
flash position,  pops under your finger, but you'll get used to i
gps and wireless not intuitive and the small size of the camera, is both an advantage and disadvantage, particularly if you have large hands.
noise of zoom
flash position its a pity
wifi a little fiddly
not really...
a bit on the expensive side, but considering you are getting video (*.mov format) at 1080p for up to 29.59min max at one shot, its a lot better than carrying around two cameras
pay attention to full card: i have lost all my pictures because when the card is full, the camera can't read the card and want the user to reformat the card...just don't full the card!
would have expected such an expensive piece of hardware to have at least a soft case for initial protection as well as a small memory card so ot could be used straight out of the box, neither of which were provided
haven't found any
not encountered any yet.
video mode picks up lens focus noise and there is no provision for an external microphone.  this can be overcome by investing in a canon ultrasonic lens - a costly solution...
my canon 300 400 all use cf memory cards for which i own a number of high quality rather expensive cf memory cards.  now i have to start over again to purchase high quality sdhc/sd memory cards.  the quality of the basic kit lens (18-55mm) is well below the expected quality of a canon lens.  the slower frame rate to achieve hd video.  lack of an external mike output.
standard lens has some color abaration on edges, can fix in processing
kit lens is very light and plasticy with average image quality.
kit zoom very mediocre quality - have bought cheap 50mm 1.8 lens and results are far superior.
some features are not adequately explained on screen (and don't have an obvious effect) so reference must be made to the manual.
battery does not last long before requiring recharge
shutter sound a little loud for wildlife shots.
1080p hd slow frame rate - ok for landscapes but 720p better for moving objects. better still buy a canon dedicated hd video camera
cant think of any bad points at all. i've had the camera for 3 weeks and enjoyed every shot!
should not be considered as an alternative to a movie camera as its facilities to shoot hd movie are limited.
no bad points
i haven't found any so far.
no dvd tutorial available to help you master the controls,and give you confidence to progress.
i would of preferred more easier control options in the menu, although in auto its self explanitory, having a few extr settings like on the sony a330 would of been nice
haven't found any yet. the only slightly negative commetn to make would be that the camera didn't come with a memory card and you cannot take images without one.
can't find any yet.
can't think of any.have always been a huge fan of canon!
cropped sensor, but as are all models in this range so this point should not be a problem, lens end rotates when focussing, so no fade filter can be used easily, this can all be done easier in post anyway.
bit confusing at first, getting on to jpg instead of raw, but once done, no problems
video and live mode focussing is slow.
why dont camera manufactures supply cards?even a 1gb would get you started.
the white balance and iso settings in full automatic mode do not always give the best results. better used in programme ae mode than auto.
haven't found any yet
no card included and standard lens gives good quality pictures but feels a bit cheep.
kit lens build quality is not great, but certainly adequate.
non
the lens fitted on the camera package however is fairly limited so i intend purchasing a telephoto lens at a later date.
currently still a tad pricey
the mode dial. need to get rid of the easy modes and just have the pasm modes.
the lens it comes with is not fantastic so i would recommend anyone buying this to get a bigger lens with the pack when they buy it.  the shutter function is also quite noisy but these ar small points for an excellent camera
sometimes buffers a bit so can't take another pic quickly
video mode isn't great (only 20fps at 1080p)
no movable screen(can't adjust the screen)
the grip could be a little bigger, it's a little unconfortable to hold it due to it's size. the functions could be more easily adjustadble with more dials.
video not doing autofocus
has only 9 af points against 11 in nikon d5000
basic lenses ar ok but can be soft at full aperture. don't think camera would survive knock - quite plasticy.
price but i always wish things were cheaper!
did not encounter any yet
can't think of any at the moment
instruction manual not very clear in one or two places. some of the switches/buttons are very small
may be over-complicated for beginners
can't find any for the moment.
plastic body- could be more robust
the price is too high.
in past have had difficulties with damp getting into canon cameras-hence need to replace
more plasticy appearance and feel compared with my eos 300 35mm camera
i miss the 'extra' features avaliable on the powershot cameras...
not found any as yet!
feel about it but no problems with the build quality so far.
camera bag is coming unstiched on front pocket even though hardly anything put in there
should have small individual fitted case with it a standard.
nothing
0
n/a
still learning about it, but haven't discovered any problems yet.  canon reduced the rrp a couple of weeks after i bought the camera!
on off switch very small
not found any yet.
the supplied strap is covered with logos (thats a bit of a personal bugbear) and not the most comfortable thing on the neck.
rear screen much improved though still difficult to see in bright light - hoped it would be better.
it is'nt free.
on/off switch difficult when mounted on a tripod
takes some time to learn the more specialised features.  will probably still be learning in 12 months time
haven't found any yet.
can't think of any.
the video option is missing
not found any yet.
a little heavy but that's about it
on off switch looks a bit flimsy.
as i expected it is heavier and have therefore had to invest in a new sturdier bag to carry it and my equipment over a period of time. i expected this though and do not see it being a problem.
non really
heavy....but you get what you pay for
cannot find any
perhaps could have easier access to some of the menus and facilities
had to buy compact flash cards as my 450d used sd's, no big problem though
non
on far to many times i find that this dial has moved, and now have to check every time that the setting has not been moved...................very poor showing here canon
, people who want this should buy a simlple compact.
haven't found any.
not enough time to use it
non e so far
digital noise very poor on relatively low iso
takes a bit of getting used to in order to get the best from it
- fiddly on/off switch.
no
still doesnt take sd cards
graining  at high iso levels is slightly worse then what i expected, although  can be easely compensated with adobe lightroom
lack of movie mode may be a problem for some.
my flash not working !!!
not so keen on where the on off switch is - prefer it to be more accessible - but that's the only negative thing i can say so far
no bad points.
as yet, i haven't a great deal of negativity to share with you all. i thought it might take a while to get to know all the features and therefore not get any good pics but this is not the case.
can be a little bit noisey at high iso, but this is fixable by exposing correctly and is quite easily remedied is photoshop.
more things to learn!
nothing son far
the on/off switch is awkward to use.
body material feels like cheap plastic but lightweight.
point considering the price and level of this camera. i mean, you can't ask much more from an entry-level dslr.
very noisy when the live view turns off, so far this is the only negative point.
film setting awkward to use, but works fine andtakes good quality hd movies
difficult to use focus ring on lens when lcd screen is rotated out, could just be something to get used to doing.
a little heavy
no real bad points other than it can be quite expensive to get quality lenses to go with it.
isn't quite what i expected and is quite difficult to control focus.  same applies for the hd movie mode.  part of me wishes it was a mag/ali case rather than plastic but the price hike to the next model up was just too much.
only minor issue is the slow frames per sec. could have done with being a bit quicker but i can live with that the the relatively low price paid.
can't think of any just now but i may find something one of these days.....just love the camera to bits
make sure you buy class 6 or above sdhc cards (doesn't mention it in the manual anywhere; using auto-focus in live view mode is difficult - the lense keeps hunting, so switch to manual; manual focus is a bit tricky when the screen's out wide to the left
only manual focus on video.
1
no
no pc connection
non really only two weeks use so far though.
can't think of any.
live view is just about acceptable.
the drive mode could be faster-a bit laboured at times. would prefer iso settings to be at 1/3rd stop increments rarther than the full stop increment.  but these are fairly minor quibbles
it wasn't clear to me that no lens was included, so i had to purchase a lens separately.
nothing really given the price point.
feels a bit plasticy.
different batteries to 40 d range a real pain had to buy another spare. the accessory fittings are different also to 40d range so accessories won't fit this camera, particularly studio lights, so has been a night mare sorting out the extra's i needed before i could start shooting again. all this they don't tell you before you buy!
not found any yet.
plastic casing
the tamron lens is not well suited to floral/insect macros. it,'s a basic lens more designed for entry level widelife photography but provide good introduction to zoom lens usage.
bag is not very good, i bought a different one within days.
if you're going to offer a bundle then make sure the bag comfortably carries both items.... i'll probably end up buying another bag. not a showstopper but a little more thought about putting a bundle together is needed.
a bit on the pricey side but i got a good deal online
with some many features you have got your work cut out in terms of getting the most out of what this camera can do. the best way forward would be to attend a 3 day course as it's difficult going through the hand book and to be honest we perfer to play than read!!
difficult to criticise. metal body would be great and smaller f-stops but then the price also rockets so great value for what it provides.
i just havent found any yet.
haven't found any so far.
the raw format is not standard on older packages, such as my 5 year old photoshop and new serif photoplus x4.  ms.net has been corrupted on my pc and so the eos utility won't work.  i have to convert from canon cs2 to dng.
never got item
trying to get it back from my 11 year old grandson he thinks its ace but no bad points
fitting the lenses and camera in the bag.!
not the cheapest option around.  went for the twin lens option but the bag won't hold both of them - so need another one.
it feel a little bit plasticky, just a little bit though.
shoot user, as fully auto modes do not always give the best results that the camera is capable of.
the one thing i would change would be the place of the flash as when turning the camera on i find my finger gets in the way so it doest pop open. but it can be lifted manualy.
not too impressed with the loss of 3mp when you activate wide-angle shooting, but 9mp still gives a crisp enough images for photos of friends.
as i have only just purchased the camera my only complaint is regarding the instructions only being found on the dvd.  as a new user it is very helpful to have the information readily available without having to open up ones computer.  you can't easily carry a dvd player on holiday, certainly not for the majority of people.  i would have willingly payed more for the approx 206 pages.
.
as mentioned by many others the flash is a bit awkward. it's easy enough to stop it popping up when you turn the camera on, but if it transpires that you actually need it you have to turn off and on again (unless there's something that i haven't figured out yet). nothing bad enough to outshine the other excellent features.
instruction manual distinctly lacking in info so doubt i am currently getting the best out of the features, all of which i am still trying to find.
pop up flash irritating
i bought the leather case as i felt the camera needed protection as i tend to carry it in my handbag.
nothing much
flash opening every time you switch on camera
flash is in wrong place but it doesnt worry you, just push it down if you dont need it, apart from that minor issue the camera is great
you need 5 presses of buttons to delete a photo, sometimes slow when saving however might be due to the memory card.
would prefer a better manual rather than printing out disc from pc.
one of the bad points is the location of the flash, this is where you would hold the camera. also the flash pops up when you turn the camera on.
battery life
i would like a wrist strap in case it was knocked out of my hand or i lost grip.
one small screw missing but overall very good build quality.
no arbitrary exposure time.
haven't found any yet...
annoying pop up flash
have a tendency to over compensate in low light.
battery life short (get a spare), colours in pics sometimes not quite right, not sure why
not so easy to use with just one hand
lacks direct vision veiwfinder
menu can take a little while initially to get to learn
to open the battery compartment is not allways easy
battery life perhaps a little lacking but a spare battery soves that quite easily.
maybe the the downside would be the pop up flash,it should have been integrated into the camera,
flash is in a bad place gets in way when trying to take pics
holding the camera to take a photo - finger sometimes holds down the flash which prevents it from functioning properly.
