very few at this price. if this was up near its original cost, there might be a few niggles (slight chromatic abberations and a softness to the image etc) that might be a little less forgivable. but this is a superb little camera!
buttons shuffled from previoius hd models, so not as intuitive to use as i'd have liked
no viewfinder, average screen.
the zoom lever is a bit over-sensitive and it can be difficult to control.
some areas of the user interface a bit clunky but these are a minor detail with respect to the overall performance
only lasted me three months - once the extended lens is knocked, the camera doesn't work.  i find this with all of the canon ixus cameras so have now switched to panasonic lumix tz20.
as i dropped my canon ixus 130, and the lens broke, i'm worried the same could happen to this one too - but that's probably my fault.
nothing really
not found any so far!
nothing comes to mind
image quality in low light conditions
battery life not brilliant when used heavily - ie. lasted 1.5 days with heavy use.  camera body looks like it could scratch easily.
fells cheap in the hand, trade off for being so light a weight i guess
has 'stitch' function but no panoramic sweep function.
quite small for someone with big hands
menus a bit fussy
night shots/low light. no sunset option as in older canons. colour accent pictures without backup of normal one
should come with case and memory card
when using movie mode you have to pan across very slowly to give camera time to auto focus otherwise bluring will occur. wind noise can be a problem with outdoor sound.
fragility of telescopiclens struc
the lens got stuck and had to get it replaced....
(though i haven't read the manual, so i might just be missing it)
the only thing that annoys me a bit is that it doesn't remember settings. eg changes to aspect ratio, or selecting vivid in creative auto. once it's turned off then on, it has forgotten. i might be able to get around that by making use of the user settings, where you can setup and save favourite settings, but i haven't tried yet.
for the money? nothing bad so far.
manual is a bit overly complicated and requires a lot of concentration to understand.
earnings from my part time job. additional lenses could be costly.
just one thing.the kit lense (18-55mm is) is not performing well in low light conditions
lens - definitely i need to buy another better quality lens.
it took me  a while to figure out how the video worked. i thought that all you did was turn to the video symbol and press the shutter button
are their any, haven't foubd it yet
wish you could view the instructions in the viewfinder as well as on the screen.
get told off by my wife for taking too many photos.
nothing.
not yet - i just need to learn how to use it properly!
small camera body is difficult to hold with more than 2 fingers if you have big hands, solved by buying an ext battery grip. we can now shoot 4hrs+ 1080p video with the twin battery powered grip. ;o)
only one i have found so far. on the wite balance setting option you have fixed preset values representing 5200k 7000k etc. i would have prefered the actual k option included in the list, surely it is only a small change in the software since if you select auto white balance it can and will select k values between the fixed presets.
a few buttons have been moved to allow for the tilt/swivel screen to be fitted.  this will take some adjusting to for those who are very familiar with the layout of earlier models. this is a small niggle that will disappear with a month of usage i'm sure.
curry's took 4 days to process my order which was placed at the beginning of december. i was told this was due to all orders being manually checked to prevent fraud as it's more common at this time of year. if this was the case, it should have been stated at the time of order but wasn't and took a phone call from me after 3 days of waiting to find this out.
when shooting in video mode with the supplied lens you need good light or the images will be dark.
wish i'd upgraded to the 18-135mm lens instead of the 18-55mm
canon software a nightmare. im sticking to computer photo software on a mac instead.
lots to take in for a beginner, but that's my fault - not the cameras!
as i have the camera only a short time  i have nothing bad to say about it at this moment in  time.
poor manual - buy the dummies book!
not yet
the serious wildlife photographer may be alarmed at the shutter noise.  i  bought a canon camera as i was lead to believe that it has one of the quietest shutters.  out in the field i felt embarrassed because, while the other dslr's whispered, the 600d shouted.
if you wanna take some good pictures you must change the lens, not as good as the reviews say, especially in dark conditions, generally i thought this camera would be better in dark conditions but it isn't.
the rotating screen does not do a full 360 and i nearly broke it. bar that i cant fault it.
price, although canon is a very good make and i chose this camera over the other competitors it was a hard pill to swallow (although would make the same decision again)
would be nice if it had a full sized sensor
ef-s 18-55mm will not be sufficient after a short while.
a little complicated at first
will take a while to learn how to use all the features, but will be worth it
nothing yet!
kitt lens.
not really a bad point but if i had to choose now i would probably get a 60d not a 600d, simply because if the faster fps and more alround build quality.
may get some unfocused shots untill one learns how to use the camer correctly
autofocus during shooting video.
no auto-focus function whilst recording hd video, have to focus manually and the lens noise is picked up on the microphone ruining the sound.
hasn't got me laid yet but i'm working on it
there isnt much in the manuel about anything actually in the programming of the camera
size, weight, pre selection of scenes,
sometimes the pull out screen gets in the way, but easily fixed by closing it when taking a photo
have a little doubt about how long the battery lasts but i haven't really tested it fully yet and now i think about it i did use the video quite a few times for the first day trip which i presumes uses a lot of power and it didn't run out of power in about 6 hrs use
i have not found
there are not so importent if you are not a professional photographer .
that great big manual, to long winded.
ill let you know when i find a bad point!
viewfinder difficult to view through, needs an extender.
genuine canon accessories are very expensive.
as with most manuals it is a little daunting. even a little scary! there are plenty of other apps/books that make it a lot clearer. more on a step by step basis which is great for novices like me.
plastic feel to camera
some programs are a bit complicated for the novice photographer
there was no start-up manual with the camera, the supply of a 'disk only' manual requires the installation and printing or scrolling of the pdf file. this is not a convenient way of getting started with a new camera.
the shape, a bit too many rounded off corners for my liking, and insufficient grip. it feels a bit toylike in the hand.
lens rattles but works ok
don't know of any yet.
no automatic focusing (af) when in video mode, but this can be corrected by turning off af, and using in manual mode.
if your not experienced in photography, i imagine the array of buttons and features could be a bit mind melting at first
no constant focus in hd video mode...but i guess it's not a camcorder!
slow fucosing in live view. nothing at the ptice
the problem i can see so far is that the neck strap is coming in the way of the side of the screen when i shoot, so some suggestion is can it have the neck strap attached to the left at the bottom and on the right it can stay as it is, in fact i put my old hand strap of my canon powershot a610 because i have problems in it, i have been using it for more than 8 years now.
no issues
can be a touch heavy, especially when used with a battery pack. not as previously stated elsewhere (can't remember where i saw it) not the type you would carry around for a chance picture. when you are carrying this it shows you are out to take photographs. doesn't come with a record card as standard.
haven't found any yet! but if you're shooting with the pop up flash and you have a shallow canon lens hood on you get a bit of shadow on the subject, but that's not a fault with the camera.
nails tend to scratch the hard plastic body(minor issue)
not any
not found yet...
i'm still over the moom with this product haven't come across a bad point yet!
erm... maybe the size? but this is basically he standard size for all slr cameras. it's an amazing camera.
automatic focus does not work on close ups with the zoom lens
lens is ok but has poor performance towards zoom end of range, vignetting and light rings appear on the photos, also prone to lens flare.
navigating menus takes a while to get use to. slow to write to sd card, (may be down to to the 'class' of card i have though). no other issues.
lens can be expensive
havent come across any yet
can't think of any
as i'm still playing with the camera and getting used to all the features , so far haven't found any.
nothing so far, as only just purchased the camera.
takes some time to get used too, i'm a beginner
plastic cage
a lot of onboard processing - could live without ambience settings etc.  surely most dslr users edit on a computer?  macro mode has too shallow depth focus.  am concerned how long hinge will last but hopefully no problem
there is no mention of having to buy a memory card. very annoying to find you cannot use the camera immediately
i put it in my bag once and left a few white marks over the body of the camera
expensive compared to some other brands
no a/f on video. but not a big issue
you do need spare batteries .but not really a problem as they are not to expensive.
nothing apparent.
takes a bit of getting used to
that was a let down.
build plasticky but solid. perhaps a bit sub standard despite the low price.
not for amateurs
the manual gives instructions for the i s lens only.
finding a good case to keep it in
nothing
havent found them yet
the only way i could fault it is that the lens cap is a little fiddly and the lens on the 18-55 kit lens is a little foreward and is a little prone to raindrops and fingermarks. these are very minor problems though and a little care soon eliminates them.
removal of battery for charging
rather complex. it will take a long time to understand all of its features.
nothing to complain, thank you.
canon didn't allow the \xa330 winter discount
am a little worried about the flip out screen, so will mostly use it in situ eg not flipped out.
to much plastic
autofocus in video mode would be nice.
you will defiantly need to buy a better lens than the kit one.
record limit on video (12mins)
nothing so far
a bit plasticy..
need to get a more powerful telephoto lens or a doubler
haven't found any yet
- focusing on telephoto lens take ages... its quicker to do it manually... but on the end of the day this is rather amateur product than pro so overall i'm more than happy to have it!!!
this is on the bulky side so would not recommend using as a camera for everyday snap shot's.
telephoto lens is not a everyday or frequent use lens for me. would be nice to have slightly more spacious bag to fit in xtra lens .
havn't found any yet
the carry case is supposed to carry 4lenses and two bodies. maybe houdini could get them in but i certainly can't
the plastic housing looks and feels cheap for the price.
need to use it as instruction book is daunting.
lens cap never seems to fit just right,same on my last canon but not a big issue.
feels a bit 'plasticky'
takes a while to master all functions
lacking in some areas of settings and features but these can be found in the higher end canon cameras
i'm a little disappointed that to use the wifi feature i need to buy an eye-fi sdcard.
grip not as good as i hoped.
no bad points
not had the camera long enough to say.
can't fine any cons
neither lens has image stabilisation so images can be blurred at times.
can be a little complicated but once you reed the manual all becomes clear (read manual guys)
like all dslr more complicated to learn than traditional point and shoot, but this is not really a v]bad point, just a standard issue with dslr's.
very minor points though.
nothing about the camera, i just wish the lenses were a little cheaper
there are't any
nothing i have discovered so far
in store, i do not see the benefit of this method of marketing.
quite bulky so needs a shoulder bag to carry everything around together and therefore isn't particularly light when everything is in one bag!
not experienced any yet.
book a bit complicated.
soft wear a bit complex - still waiting for \xa330 cash back from canon
lens cap was lost in 2wks needs a string/ lead attachment to camera
my old sigma lenses don't appear to be compatible with this new camera.  that has taken the shine off the purchase.
lenses incorrect
cannot use in adverse weather
0
kit lens works well but feels a little plasticy
needs patience to work your way through the manual - a lot of back tracking to find what you are looking for.
to the shot meaning you may miss the moment, but overall the quality of the majority of shots makes this feature worthwhile.
can be a little frustrating using the more complex features, but this is probably more to do with putting the time in to learning.
cant think of any
the manual is overwhelming and i am still trying to figure out all the things i can do with the camera.  a video with easy examples would help.
non so far.
lots to read if you want to use all the bell and whistles
cost of accessories ie extra lenses
level. booklet should be more plainly written for people new to digital photography.
i cannot see any bad points at present but do not forsee any arising.
i am struggling to even think of 1 bad point. for me there arn't any.
somewhat plasticky in the build quality, but this is only a slight quibble.
at the moment no bad pointsv
nothing
hanot found any so far
the battery does not last more than 5 hours to record video.so you need to have at least 2 extra batteries to record for half of a day.
not much to complain about apart from the fact i noticed how nice the 5d that i tried recently felt in comparison - however, this is a much more expensive camera.  for the money, a no-brainer!
haven't found any yet
would have been nice if a lens hood had been provided for the kit lens
it's going to take me sometime to get through the manual and all the additional functions.
live view not great in auto focus lens keeps hunting for focus use manual, bit to plasticy
no instruction book supplied although it is easy to download a copy butnit is not that helpful for a novice (i have found eos 600d for dummies an essential buy)
it is bulky (maybe dslr cameras are really like that but it is not heavy).  i wish it's not black.. :)
battery was poor quality, bought another which is fine.
you need an external memory card before you take a picture so beware to have one ready for when it arrives but this is normal and this kind of camera
it lighter than some good in one but bad that is it good for quality
price and built.
symbols quite small and hard to read
light in weight
can not think of any.
can't think of any bad points.
standard lense is a bit small.
slow focus and continous shooting in live view mode.
build quality could be better.
lens
bid expensive
cant think.
hard to use, but persistent is key!
no bad points
originally provided witha case that was too small but this was immediately rectified with an appropriate replacement at no further cost.
compared to other cameras, the sensor size is quite undersized
no panorama shots
not really in a position to comment on bad points with it being my first dslr so can't compare with any other model etc
autofocus when recording video. wireless photo share.
not a metal body
rather a lot to take in, but that's because i'm old! i can't really think of any bad points - it's much better than other digital cameras that i have owned.
battery life!!
viewfinder too small: poor manual
i find i have to go far back to get subjects in as the head or feet can be cut of easily. also nighttime pics outside of house are very dark.i find it hard to find manual settings easily and quickly. maybe you can help. but i really like the camera itself. thank you
tried hard but can't really come up with anything except it is a bit pricey but you get what you pay for
annoying that you can't set the default manual exposure mode.
the number of features and how to access them will take a while to learn, but you can literally point and shoot in full auto and get very impressive results.
night shot? is there one?
not found any yet!
haven't found any.
a camera of this price should be supplied with a manual, not a disc.
viewfinder is weak
needs a screen cover when not in use.
cover for photo downloading port is fiddly and looks fragile. may not last long.
face detect focussing is not always perfect. would have liked more manual control ie shutter speed / aperture settings.
low light performance could be improved.
not so easy as some to use the special preset features
manual rather 'involved'
on/off button in awkward position
shoddy doors into download and battery compartments
view finder could be better
expensive, larger than other compact cameras, and occasional shadowing on the upper extremities of images taken indoor with flash
takes a little while to familiarise yourself with the many excellent features.
quality of night photos not brilliant.
in built flash rather weak
just the fact that to charge the battery, you have to take it of the camera and on to the docking station. which means carrying a spare if you are going to be taking loads of pictures is a necessity
obviously because its a 10mp camera, it eats in to the memory card alot, so chose your shots/videos wisely, buy a large memory card or change to a lower mp when taking pics/lower quality when taking videos.
close focussing could be better. menus and instructions very complex if all the possibilities of the camera are to be utilised.  detailed instruction are on dvd and thus are inconvenient to use in the field. a book would have been much more useful.
have not found any yet. still discovering it
fuji will be the winner.
features are difficult to use
no detailed manual
w, or change image quality is quite hard to use as it's not obvious where everything is.
perhaps could be supplied with a lsrger memory chip
a minor improvement would be smaller or little lighter ( but this is a quibble)  not a bad point  i'm a girl and these things matter in tiny hand bags and small pockets.
it drives me nuts that when i am viewing a photograph after having taken it, if i tilt the camera at all  (to left or right) the picture then rotates with the movement - it's probably a great design feature but personally annoys me!
no manual shutter or aperture settings.
the only minus was the memory card supplied ..... 6 pics and it was full ......................
picture quality won't compare to a dslr, but then you'd have to spend \xa3200+ on a compact for this to be true.
would be much more helpful if came with a instution manual !
for individual pictures - i will be very cautious in the future to avoid this happening again.
can only have the multi shoot function on the manual setting, and takes a while sometimes to take the pic. for example, i play rugby and my girlfriend wanted to take some pictures, every time she tried to do so i was out fo the frame before it took it. so i taught her to half-press on the area to focus, then press fully to take the shot straight-away. i would have like to to have a sports mode so it takes the pic as soon as you press the button.
some of the instructions are not terribly clear
increasing loss of picture clarity with zoom facility, especially with video.
slow picture taking
casing marks with fingerprints too easy
hard to navigate the menu
no soft case included
just the price but you get what you pay for.
i've had this camera for several months and so far i cannot fault it.
had to read the manual quite thoroughly to understand how to play back pictures, not quite as simple as on some other cameras where i have had a thumbwheel to move from one picture to the next.  (thats why it gets 9 instead of 10 for ease of use).
tamron lens does not have an image stabiliser so is very difficult to use at 300 zoom
i haven't found any as yet...
the only bad point with the kit i bought is the tamron 70-300 zoom that came bundled with it. even if you stop the lens down the image at 300mm is not very sharp plus in many lighting situations there is a lot of purple fringing. ok this is a cheap lens but i was hoping for results that were at least usable. i guess i need to save up for a 'proper' long telephoto.
haven't found any yet. oh yes, i keep getting the urge to buy more lenses for it.
as yet i haven't any, instuctions are well written, but it will take some time to get used to all the features.
i have no serious problems; i think it is a very good value for money.  some problems when managing white balance and exposure, the camera sometimes can\x92t get it right 1st time , but this is compensated by the large amount of options available and good use of them.
focus in live view
i wish it was cheaper..............but it is compared to other dslr's
lens that comes with camera is very limiting, so would recommend upgrading - tamron that came with the bundle is great.
terminal cover, flimsy
lack of the big scroll wheel featured on the next series up (40d, 50d, etc) makes quickly scanning through stored shots a little cumbersome.
a tad expensive.
dslr cameras are like a virus !  you'll soon be selling everything and remortgaging the house to buy more and more accsesseries, beware the moon!!!
the tamron lens hood is difficult to attach and detach without turning the focus system against the motor if af is selected.
default sharpening setting is a little soft. this can be changed in-camera, or images can be sharpened easily later (using the dpp software that comes with the camera).
because the bundle came with a second lens i think a bag should have been included.
small camera bodies can be a disadvantage if you have large hands. i looked at nikon d80 which felt much heavier and larger in the hand which gave it a feel of quality.
the tamron 300mm lense the camera came with was not fantastic, save up and get a 300mm canon lense instead, you wont be dissapointed
not bad point really for a novice like me, it takes some time to get the best of the camera.   it's part of getting a sophisticated camera such as 450d after using digital snapshot items.
flash charge time after repeated use.
shame that the tamron lens does not feature image stabilisation.
live view shooting, not a bad point, but better results are obtained by using the 450d in slr mode.  an excelent dslr canera overall.
i wish the standard lens was alittle better
complicated to use 'live view' mode
1.6 x 1 ratio means slightly less quality in images than you would get with the full 1 x 1 ratio.
just a tad 'plasticky'. good weight, though - just prefer a stronger body.
cant think of any other than it is bulky after moving from compacts
can't really think of any
the only thing i thought was not very good was the fact that their was no protective covering for the screen
difficult to use.
lens not compatible with my eos 5d
wanted video function not featured on this camera but that model was inferior for picture taking
would have liked one lower iso setting. really needs an external flash for indoor pictures
havent really come across any yet.
found it difficult to understand operational instructions, not possible to trim pictures on camera.
dont like the neck strap and lack of hand strap which might seem pointless but is reassuring!
user input required to tweak picture quality settings taht may need to be carried out rather than excellent photos straight out of the box.
why can't we have all canon lenses in these bundles? i like to have all-canon products.
instruction manual could be better put together as mine is falling apart.
would be nice to be able to use live view in all modes
only thing i've found so far that's a bit disappointing is the 450d badge on the bottom left of the camera has come off
could be cheaper
colour saturation can be a little disappointing, some of the features are hidden in the menu system
image stabilising lens not as good as the standard lens from the 400d
not bad points
i'm not to happy with the quality of photos taken using the auto settings.
can prove difficult to focus in low light
slight tendency to under exposure on full auto
takes a while to get used to where everything is and what it does (not really a bad point)
nothing major. would be nicer if the battery were charged when camera is plugged into computer, maybe.
no bag for slr or lens
i have to say i havent come across any!!!
cheap lenses but that was all i could afford being a student.
the only thing it doesn't do which some may want is to allow you to use the lcd screen rather than view finder when taking a picture.
colour reproduction is dull.
not found any yet
nothing
camera strap is uncomfortable around neck
havnt found any
possibly too small and lightweight
not found any yet.
high price at entry of product.
image stabilization on the tamron lens would make zoom shots in overcast weather easier. but for the bundle price lack of is is understandable.
haven't found any yet!
not found any yet.
no bad points
it takes it bit of reading to identify all functions on the camera (for a novice).
haven't found any yet
in between them, which can be awkward for shooting indoor pictures at a middle distance.
