i bought it to cover both stills photography and videography. the pop-out screen is fine, but in strong light it is difficult to see the moving image, and you cannot use the viewfinder as an alternative. otherwise very good quality results.
body feels cheap and light plastic, although there is a coating that helps with grip, the camera feels light and fragile, probably is tougher than it feels. i wouldn't take this out without it being bagged up most of the time.
no wi-fi
all good.
not enough time in the day to use this superb camera
nothing to report yet ??
not discovered yet. may buy a stronger tele lena for outdoor activities.
only annoying thing when working in theatres under difficult lighting conditions is the limited exposure lock feature.  the * button is ok but fiddly and it should be possible to lock it with the shutter half pressed in all modes, not just 'evaluative' metering.
it came without serial numbers which is very strange
it shoots for around 4 hours non-stop, which is actually really good in comparison but something to keep in mind. and also, it has a 'self-close' feature when its not being used for a bit, which does get quite irritating, and right now there doesn't seem to be an easy way of removing that
the camera is a gray import and
it's a shame i didn't get a free telescopic lens ;)
kit lens is but don't expect amazing eye popping pictures...obviously
it feels light and very plastic. this makes me feel a little apprehensive when holding it. i'd prefer a more solid feel. maybe an aluminium body or something more substantial. a minor detail. i'm sure i'll get used to it.
no built in wi-fi but that's not a major problem for me.
even though a beginners camera you need time to get around features though these are a plus point too
no wifi
haven't found any yet !
no bad points.
i now need more lenses...
also a dvd of a step by step guide would have also been good
construction is rather plastic
to assist the auto-focus in low-light, the flash fires a strobe flash burst which gets annoying quickly.
it feels cheep and the 18-55 lens feels so plastic, got the sigma 70-300 lens and it struggles all the time to find focus if you can afford it go for the canon.
no wi-fi, but not really that important!
on automatic setting, focus is always on what is central in the viewer. if object/face is slightly off central it can be blurred. use manual focus instead.
the speed and accuracy of the autofocus. it takes longer than desirable to focus and the result is fuzzy shots.
liveview could be quicker and video focusing a little slow to react. minor niggles.
no.
not a particularly robust camera which unfortunately means that the camera will not last too long if used regularly before lense focusing and recycle time start becoming variable
don't waste your money
no
had a slightly cheap- plasticky feel to the body
not used it yet so cannot say
kit lense! only good for portraits
instruction booklet is daunting. i am sure that war and peace is shorter.
waiting for the camera in anticipation!
nothing to clean it with
doesn't fly
how long it took to come, but it got here eventually and well packeged
not being able to see screen very well in sunlight whilst in movie mode
not really any
nothing bad about it really.
timer on remote sensor
as the camera has lots of features and modes (which is good) it can be confusing to access them as some can only be accessed via th 'love' mode whilst others are via the manual buttons. just something to get used to!
no bad points for the time being. could be more competitively priced to suite similar nikons.
in one word no
there are no bad points at all
not weather proof. but both to be expected.
it's not cheap
it's about time cameras came with a protective uv filter for the lens, and a sheet of film to protect the lcd screen, as standard. these are essential extras.
0
should come with a case
not so far.
nothing products are great and i have shot lots of photos with different canon cameras since about 1980.
zooming in video mode is difficult to be smooth, but practice helps :-)
so far nothing wrong that i can mention
can't think of any
lots of things on the menu and whilst some people may like the option of taking pics in various colours, themes, etc i think most will post process so could slim down menu a little but that's maybe just me.
nothing
you won't find any
i think the only improvment i can think of is vetter weather sealing. it's not much but there really isn't much wrong with this camera.
all good
no
it can feel a little heavier in comparison to other dslr cameras
huge instruction manual to get in to your head. that said there is so much to learn it needs a big manual.
it will take a lot of reading of the manual and practice with the camera before i am able to use the camera to its full potential
slightly over priced, but then again it is a canon. needs a uv filter to protect the optics.
still feel video mode despite using a fast sdhc card a bit jerky frame rate. trying different settings so hopefully get it right. maybe best not to pan too much
battery won't last long if you use it for a lot of video recording.
i o not see any.
am exploring buying new software.
heavy
battery is low live
no bad points
expensive
yet to come across any
a bit plastic-y at first feel
it would be great if the build quality made the camera feel somewhat more robust.
leaving smudges on the screen display when using the viewfinder.
plastic body can be a bit light on better lenses.
nothing as of yet
non
i am probably biased but i cannot fault or find any bad points.
expensive
haven't found anything yet.
i can't get the wifi to connect directly to my computer to upload images.
awkward on/off switch
release a mirrorless dslt.
nothing bad about the camera.
canon has limited the usability of wifi - cannot use to connect  to computer.
difficult to connect to ipad
it isn't weatherproofed so watch out.
nothing at the moment.
little plastic feel in build quality
gps requires more...
hdr . .  i can't see the difference and i can't find any way of adjusting it to make the effect more noticeable.  :(
nothing i can think of.
nothing so far.
nothing
no bad points to mention so far
batteries  not the same as the 60d(had 7 with battery grip) so have to get a new spare battery
nothing
i like everything
so please, register the things, when you send!
i had to return the camera as the mini usb port did not work meaning it would not tether with my laptop if i was not in a wi-fi area. i have requested a replacement.
you can't use a sigma or tamaron lens with this camera. hope you market leaders will start talking?
weight. would like it a bit lighter.
strap is thin
*you aren't going to get dslr style shallow depth of field with this size of sensor. if you need this then you will have to get a bigger camera (dslr or mirrorless csc). i won't be selling my sony a6000, but the canon powershot s120 fits the bill when carrying a bigger camera is not practical.
like most cameras at this price there is still no viewfinder!  however, you can adjust the brightness of  the rear screen so it is  brighter than before - although that uses more battery.
haven't really been using the camera long enough to find too many bad points...auto flash with underwater setting needs to be reselected when the camera is switched on. maybe i can overcome this using custom ...will need to experiment.
manual flash ejection
no cable supplied for direct download to pc
not much of an upgrade over the s110.
having to use canon image gateway to transfer images by wifi - not a versatile interface e.g. can't download multiple images yoru device (have to download each one individually from the website or app), rrp expensive
touch screen can get in the way, just takes a bit of getting used to!
the camera was faulty on arrival and the customer service has been very bad.
lack of optical viewfinder, cannot charge battery via usb
mediocre image quality, but what do you expect in such small camera
would like a basic user guide and also a lead to connect to my pc
very few
user interface could be easier for old people
it's a slightly old design now but at a great price and is still a great camera.
image quality, features
needed a uk plug on the charger
takes a while to navigate around all the different features
haven't found any bad points
flash
the ring around the lense i was hoping was a manual focus pull ring, and its not. but this isnt a big issue for me.
not easy to hook up with wifi or my my mac computer
dynamic range too limited
quite a small battery capacity. narrower aperture adusting range when you zoom towards tele.
manual is only a formal description, does not tell you how to use the camera.
off/on switch a little fiddly.
some features are difficult to access / not self explanatory. the lack of a printed manual makes this worse. you have to download the manual and all software.
small (obviously!)  so just holding it takes some getting used to, compared to an slr - perhaps a slightly larger grip could be built in? -  but the features and photo quality make it a great piece of kit.
battery life is rubbish. doesn't come with a sd card. you can't charge the battery via a usb cable in the camera.
guarantee for 2 years should be included as standard.
a bit pricey not used any functions to rate them
it's a shame that canon could not have included a lens hood with the lens that i bought. for the amount that the lens alone cost, a lens hood would not have broken their bank i'm sure.
i would rather have wifi ( so i can remote it from a phone/laptop) than gps ( i usually know where i am)  and it really needs moveable screen ( such as on the 70d)
i keep pressing the wrong buttons to zoom in during playback.  old habits die hard.
the camera was a christmas present and i have not found anything that i would complain about.
no wifi
nothing
no
no wifi
af system does take a lot of practise to get the perfect shot in aspects such as birds in flight
no wifi, who wants gps?
nothing
no touch screen. a lot to learn.
no
only thing its a little heavy but that was expected and is so solidly built
cost of battery grip.
really slow delery, took a hell of a long time to turn up but for the money you save...well.. its worth waiting for
battery life
the price
no wifi
not yet; i am still exploring all its capabilities.
don't have any bad points.
not really a bad point but just be aware this is not a simple camera to operate and it will take some time to get to know all the functions and how to use them.
maybe two many features some i will never use but great piece of kit.
takes some setting up, still no wifi feature.
nothing
nothing bad so far in the first month of use other than a tiny amount of digital noise at the high end of the iso range, but this is to be expected with any camera and is easily overcome using software.
there are so many features on this camera for me it is going to be quite a learning curve
power consumption, bad screen.
i would like to have 10 more megapixels. :)
the 7d mk ii has a lot more buttons than my previous 650d, so it's going to take a little while to learn the functionality and find out what this camera can do.
focussing system - though no doubt excellent - takes some getting used to. so many options, and less intuitive than i'd like.
no
image quality only sightly better than the 7d from iso 400 to 800. noise becomes an issue for me above iso 800.heavy on batteries, so carry a couple of spares and having to use the main dial to magnify images when viewing on camera. i much prefer pressing the button on the 7d.
it does'nt have wifi.
body and lenses checked for calibration by cannon, no fault found.
can be quite complex to set up the focussing to achieve exactly what you want.
different way of reviewing pictures, unlike all the other canon cameras i've used
not yet
nothing
disappointing that some advanced features that are on other recent releases were not included. no articulated screen.
my d7 battery pack won't fit the d7 mark 2. will use a third party
there is a steep learning curve - it is a complicated camera.
heavy. but little else to fault.
expensive
heavy but then it is well made
meets my expectations.
the only down side for me at the moment was the price.  whilst this will come down in the months to come, i still feel that an upgrade from the 7d was well worthwhile
high price
not found
no wifi
battery life is a small step backward, overall image quality is significantly improved over the 7d but still inferior to full frame cameras. not quite as much extra reach with long lenses as 1.6 crop factor would suggest and no advantage over ff in this respect above 1600iso.
as you'll see from the spec, it comes with quite a few separate accessories (lens caps and things), so i would strongly recommend buying yourself a camera bag to keep everything together.
battery life is a little limited but the acquisition of a second battery has solved that problem.
does not come with the flash unit
although the touch screen is great, i would swap it for a view finder for in bright light
no in camera raw development
should be sold with lens adapter included as there are currently only 3 lens available.
no viewfinder (because its mirror less, the screen is impossible to see in the sun), adapter needed (at a hefty \xa3100) to attach standard canon lenses. no tethered shooting!? this one actually almost take it back. all other eos cameras can, why can't this one?
still looking for some!
no viewfinder.
a optical view finder sometimes can be useful especially in bright sunlight.
it's fairly heavy
no ability to use wireless or usb remote (ir only via front facing sensor which is restrictive for 360 degree panorama boom work using 8mm fisheye).  maybe this can be fixed in the firmware?
not really.
the technical jargon for the various uses is sometimes difficult to understand but on the whole a great camera.
this is a great camera, the only bad point is that focusing can be a bit slow especially in low light.
would have liked to have a manual included.
downloading videos is not easy as the canon site does not reconize the camera and no lead is supplied with it
min aperture f/8.
no guarantee documents (or any others) with the camera
view finder near useless. lens casts a shadow. a bit too heavy.
fix monitor
manual is far too long. it needs condensing
no manual came with it
possibly a bit expensive.
the only minor point is if you have large hands the camera is a tad small, but add on the thumb clip that is available it makes it easier to handle
the lens could be slightly sharper and a 'real view' through the viewfinder
enormous amount in the on line manuals which can be a little overwhelming.
possibly the lack of a tilting lcd screen though this hasn't caused me any isseues as yet.
aperture correction and the program selector button on the too of the camera turn too easily.  always have to check them when i take camera out of the case
wind noise on video mic.
the exposure compensation dial is to easy to knock, so you need to check it.
a little bulky compared to many others on the market but my favorite
menu structure takes some time to understand.
i regret the lack of tilt/swivel screen which, as a pensioner, i would have liked for macro nature pics.
write speed can be slow on bigger memory cards
no tilt screen, would like to see made more compact, ambitious i know
no case with it.
connectivity with smart phone seems not easy would be useful to control camera from smart phone
the position of the flash is a bit awkward as i have nowhere to put my left hand fingers when taking a shot.  also my left thumb tends to cover the screen but i have purchased protective covers which solved that problem.
could be a size of camera to keept in a hand, or that maybe me, not find yet.
strap is fiddly to fit
a bit heavy to carry and clumsy to handle
when i pull it out of case quickly to take e.g. wildlife the settings can slip around unnoticed e.g. off auto to something else spoiling the image.
not possible to upload to dropbox using wifi
haven't found any so far.
very difficult to attach the strap
high level of background noise is audible on video playbacks
no paper or disc instructons
no hand book
camera now uses more plastic in construction compared to g10 so hope it is as solid as older model was. on the positive side it is lighter. one big thing i miss is the hinged lcd screen. that was useful for holding camera and taking shots at an angle.
200+ pages of the manual to read or download took ages and was laborious.
side panel cover very flimsy
some controls close so together that it's easy to change something by accident - at first.
shame they don't do the reversible screen last seen on the g12.
have not come across any at this stage
macro disappointing , but you can attache a close up lense via an optional filter adapter which gives acceptional results.
no fold out lcd, (but it did cost me \xa3120 to get that fixed on my g12) so that won't be breaking on a 16, loss of asa (iso) speed dial, now has a pop up flash! (that will break instead of the lcd!) build does not seem as study as the g12
viewfinder coverage a little poor.
focusing points to every other objects than humans
be nice if the eye level viewfinder could provide more than the 80 per cent of the actual scene under view
haveing to get instructions from internet
nothing
irritating that i had to buy a manual, as it cam with no written operating instructions at all
would have appreciated location co-ordinates.
fitting the strap!!
the wifi is basic, you can view and transfer photo's but you can't control the camera remotely
no electronic viewfinder
you need to buy a book on the features as there is little information provided to get the best out of the camera.
not a bad point really but getting to grips with all it's features takes time!
no
a bit fiddly changing options
doesn't come with a case, which is a bit silly for a small camera like this.
it has so many features, you need to buy a manual to teach you where to find them and how they all work.
i miss the dedicated iso-setting wheel of g10. would be nice to be able to delete pics from camera via connection with computer. (mac) maybe a little pricey at list price.
no documentation.
not yet
i still miss the fold out lcd screen on g12
lack of instruction manual
lack of an articulated viewfinder screen which canon featured on earlier models
the wifi doesn't allow remote view when shooting
battery could last a little longer.  quite a complex camera
the dial has auto next to video and it is easy to move it to video without realising.
no flip out screen
not yet!
a user guide would be helpful
no
no manual or quick guide just a 221 page manual to download -in very small print!
it's quite a weighty bit of kit.
really can't think of any.
exposure information in the viewfinder would be a bonus.
i was a little concerned that the packaging suggested it was for the japanese market only!
nothing at the moment.
non found yet
could be a bit bigger
not found any yet!
just a pity it hasn't got a touch screen
when using a filter extension you can see it through the viewfinder. locating a suitable case to accommodate the camera plus the extension was  a bit of a search.
absence of hardcopy user manual.
product came without operating software or paper booklet
lcd screen not articulated
lack of a moveable screen.
more optical zoom would be nice, wifi awkward to set up but works well o centre it is.
no remote via smart phone, fixed lcd screen
no swivel on the screen
not found any yet
worst eyelevel viewfinder in the world, this really needs major design alterations. interchangeable lens would have been a nice extra feature and resolution could be a little higher say 18 megapixels.
.
no manual included and online copy over 200 pages.
i feel its not as well built as the g10. pop up flash is annoying.
no flip out screen (as on previous g series cameras)
disc supplied was all in japanese
wifi seems exceptionally complicated to set up
price could be my only complaint
expensive (but its worth it)
price
nothing, !!
it's not bad to say it's heavy but the weight may be an issue for some people.
heavy!
heavy
haven't found any negatives yet!
it is better than the 5d mk iii, but it's quite a big jump in price as well.
are you serious????????
no head phone jack
nothing
why put high def video on what is designed to be a still camera.  i feel it would have been better to just issue the 1dc as a video equipped camera and kept the 1dx as a still camera.
no..
being honest it's not a bad point really! it is heavy! but i like that.
sync speed of 250/1
no inbuilt wifi , but can use eye-fi card
some of the menus are a little confusing.
no wi-fi or gps. if you are used to taking photos on an iphone, this will take getting used to.
not a genuine canon product
plain black grips, coloured grips would be really cool.
it has a very cheap feeling textured plastic body that doesn't feel nice to hold. touch screen feels a bit flimsy.
with the weight of the lens i bought with it, the strap is a bit rough on the neck when carrying it.
battery compartment a bit tricky to open.
the only thing i could criticise is the camera body is a bit plastic looking but that would be it.
no
not really
very heavy!
not found any yet.
quicker delivery time would be even better.
camera it's fairly heavy.
not wifi
--
plasticy feel
i haven't found any yet.
nog niet ontdekt
-
not full frame
not found any as yet.
plastic body.
no information about how to reclaim the \xa350 cash back from canon!
only had it for a week so bit soon to tell.
feels a bit plasticy
the only winge is that the on/off button is to close to the shutter button so without care you can turn the camara off instead of taking a photo
although the on/off, shutter and video buttons are well positioned and easy to use the others are a little fiddly.
no real bad points but you need lights so i'm going to buy some for my next trip just to lighten every thing up and show more colour but you can take really great pictures with out lights
item delevered was japanese market only, so all setting were in japanese. eventually found where to set language to english (second to last setting on 'tools icon'). bingo no squigly lines just english, chuffed to bits.
delay between shots. need for focus before making shot (fish don't pose ). first battery charge ran out very quickly - second charge produced much longer life.
nothing as yet.
no
narrow aperture lens
nothing bad at all
battery charger is a us plug, so you need an adaptor for the uk.
battery life doesn't last that long before needing to recharge.
have to be careful with the lens
sadly no case
too many of the excellent settings are buried in difficult to reach sub-menus. (those awkward thumb buttons again)
have not found any yet.
not as many features such as the zoom range as others but there again you can't have a waterproof camera and a big zoom range.
delay between shots. need for focus before making shot (fish don't pose ). first battery charge ran out very quickly - second charge produced much longer life.
narrow aperture lens
sadly no case
nothing bad at all
have to be careful with the lens
it's quite pricey, and about worth it but if the cost is for the video features, it would have been a better camera if cheaper and just for stills. the wrist strap could do with a  'running' loop so you can tighten it around the wrist. it's so loose that it will easily slip off over your hand.
so far as i can see, there is no time delay option which i am disappointed by.
low sound on the video, no case with the camera,
not easy to master. sometime the complicated menu make reaction too slow to fast moving scene.
delicate, no touch screen and good price is in sky.............
the camera doesn't easily sit on it's base safely, it tends to roll over!
that is the only niggle i've had with it in two holidays and several nights out...
sometimes pictures are not focused properly.
no special bad points at the moment.
very difficult to affix the strap to the camers.
camera didn't come with a case so i purcahased this separately.
camera does not come with memory card
when shooting a video aand you zoom in. the lens is quite hard to zoom in and if you dont have a tripod you'll probably loose the stability  and stillness of the camera and ruin the video because your gonna shake a little but if you have image stabilization on it will help a lot in shooting a video without a tripod.
with the lens i chose it was a little heavier than i thought it would be all together but i will adapt to it in time.
have to remember to switch off the camera each time or the battery runs out and has done to me too many times.. previous cameras had auto off.
bigger than compact cameras.
nothing as yet!
can't find one
nothing up to now.
if faulty like mine has to go back to hong kong
still loving it.
no user guide included in box
haven't found any yet
not found yet
haven't found any as yet
slow focus on video. zooming while videoing is not smooth and loses focus.
bought the camera instead of some wallpaper and paint to decorate the house.....not gone down well
filter attachment ring is larger than that on the 450 so existing filters don't fit the supplied lens
the only negative is that this is a camera for advanced photography. if you're a novice, this is not the camera for you. on the other hand, if you know your iso, fstops, and shutter speed, this is an amazing camera for the price!
at first, the number of physical controls and the features behind them  proved a bit perplexing. shooting on manual at night was not self-evident on the first go, mostly in terms of focusing. the somewhat unmeshed dichotomy of conventional viewing and live viewing as well as the rather short battery life bring down the rating from 9 to 8.
plastic finish feels /looks cheap but works to provide a good surface to grip on
