8.0|#|solid and relatively easy to use, fantastic screen, full high def video very impressive as the sound recording|#|pictures very grainy in lower light and at full zoom the picture quality deteriorates completely, looks more like a painting than a picture so they should not have bothered with the intelligent zoom feature at all as it just tempts you to use it. the picture looks fine on the camera screen but when its uploaded to a computer screen it is very poor.
9.0|#|daylight photography, video quality with good lighting, nice zoom, excellent lcd screen, good battery, very fast shooting, nice macro and manual focus, very good colors|#|very bad low light photography, bad low light video,
8.0|#|Fixed all the irritations on earlier models.  Great display and image quality in good light.|#|Low light performance less impressive and accessories expensive - batteries, flash gun.
9.0|#|I recommend this camera.|#|The only bad point i have come across is that the len's cap is a little awkward, but that is just nit picking.
8.0|#|Looks good and has a nice weight ballance.|#|Lens cover is a bit fiddley to put on at first, and prone to fall off without you knowing if it is not put on correctly.
9.0|#|being a beginner this camera is so easy to use and makes photography fun to do|#|no manual you have to download the instructions
10.0|#|Takes great photos even just point and shoot or on manual control, easy of use of the controls and features it's highly recommended|#|None found as yet
8.0|#|Very good image quality. the complicated menu is OK if you only want to use the simple operations.|#|Occasionally, and for no discernible reason, produces out-of-focus images, in spite of using near 1:1 zoom and with the anti-shake feature in action. This is something I have experienced with earlier models of the FZ series.
8.0|#|very good camera for money.|#|rattle on lens, when retracted. Well known problem
8.0|#|God quality picture when the light is god and the good range of focal lengths|#|Bad handling in PC and no Remote shootings from PC
9.0|#|Great all in one camera, I wanted something with a decent zoom, plenty of features, some manual control for when I can be bothered and not too bulky. Thats what I got when I bought the fz100. Technical reviews will tell you its ' noisy' over 400 ISO and there may be ' purple fringes' at full zoom. I would suggest of interest only to proper photographers with a bag full of DSLRs and lenses. For me as a recreational user taking pics of the family and dog, holidays etc its great. The price has come down quite a bit too.|#|If you have biggish hands you may occasionally hit the green replay button rather than menu select until you get used to it
10.0|#|Particularly kike the fact that the viewing screen can be turned which allows photos to be taken almost at ground level|#|You get what you pay for and for that price I cannot find fault
9.0|#|This camera is very easy to use, takes amazing pictures indoors and out, has a very impressive zoom and wide angle with good image stabilisation - I've taken photos zooming in on people 100metres away and it looks like I've taken them from right next to them. It also has a great intelligent auto feature that automatically switches between portrait, landscape, macro and multi-face recognition/ tracking. The HD video camera is excellent quality too, but I've used that a lot less.|#|The HD video camera seems to be time limited - it takes footage in bursts then stops and you have to start again. Unless there's a setting you can change that I can't find, this is quite frustrating especially as I have a 32Gb SD card, so I'm not stuck for storage space.
10.0|#|Lightweight. First class images at all ranges of the focus. Incredibly sharp images that canbe blown up perfectly adequately for all amateur photographic needs. Almost good enough for professionals.|#|Sometimes difficult to match colours exactly.
9.0|#|Haven't downloaded or printed any photos yet, but on the camera's LCD they look good. Great number / location of external short-cut buttons. Great zoom range. Easy menu. Lot's of other features I haven't discovered yet. Good grip / handling for a bridge / point-and-shoot camera.|#|At the far end of the zoom range quality drops (but expected), compared to my SLR bodies this one feels / is 'plasticky', doesn't balance well in my hand (lens heavier so it leans forward), grip too small.
9.0|#|Right since the day I bought my FZ 20, This is the third FZ series I have had. This is the best by far in every respect. All the features are easy to use. The lens and the zoom operation are the best on any bridge camera to the point where it is really serious competition for SLR's. I cannot think of a better camera to take on holiday. With a decent size memory card you can take enough full resolution pictures. Remember taking full size resolution photographs is not always necessary but it enables you to take just a section of the picture and still enlarge it to what you want.|#|Slightly slower to delete all photos than the earlier camera but this may be down to a cheaper memory card. Other than I for all normal uses it cannot be faulted.
9.0|#|Excellent camera for the price. Controls now better placed for ease of use.|#|Changed the shape of the battery so can't use ones from other versions of this camera which means you always have to be a charge source - or buy another battery especially for this version.
8.0|#|The 1080i and 720p video settings are good. If you don't need 1080i go for the FZ45 which is 720p only but otherwise identical and much cheaper. There are bucketfuls of settings to choose from. I bought it primarily to use as a camcorder as none of the new camcorders have an optical viewfinder. The optical zoom on this camera during video is very good - so much so that you'll need a mono/tripod to get steady images at full zoom.|#|Learning curve - compared to my old Olympus E410 DSLR, it takes a long time to figure out what settings you need in order to get good still images from this camera. Make sure you get the dual PAL/NTSC video european version of this camera as the other option is NTSC only for the americas version as is not as flexible.
9.0|#|Simple and easy to use. Good explanation leaflet for initial set up.|#|None.
10.0|#|Excellent camera, easy to use. Dont need to be a brain surgeon to work it out. Highly recommend camera.|#|
8.0|#|Highly recommend it.|#|looking in non flash darker shots.
8.0|#|Bags of features. Great Zoom. Brilliant Burst Mode. Not tried the Video Mode yet but looks OK. I wish the Video start button was on the back not on top - but it is OK.|#|The manual in PDF form is poor and is not the easiest thing to understand - but it covers what you need to know. The best way to get to know waht the Camera will do is to use it!!
8.0|#|Good zoom range, easy to use|#|A bit plastic, play in lens mounting.
9.0|#|Excelent range, easy to use and more than just a point and shoot|#|sometime slow at focusing when at high zoom.
9.0|#|Very easy to use, but has the flexability to allow the user to create their own settings.|#|None3 so far
8.0|#|excellent features - especially the zoom and the flexible viewfinder|#|haven't found any yet
9.0|#|Fantastic product with ease of use and superior build quality|#|None as yet
9.0|#|Virtually everything.|#|The wind-cut feature on the microphone is ineffective when making a video outdoors. I shall probably have to invest in the optional external microphone.
9.0|#|Superb Zoom, great range of features and wonderful picture quality|#|No paper manual, you have to boot up the computer for the instructions. OK for a pro, not so good for an amateur!
9.0|#|As a relative novice the camera and me have produced some good pictures with little practice. The HD video is also very good. I havent yet loaded the CD but have taken approx 300 photos put them onto the computer and i am really pleased with the results. Easy to use battery life seems good too not yet had to re charge after taking all the photos and reviewing as you do. Well pleased with the product.|#|
9.0|#||#|Manual focusing is not that practical as you have to use a small wheel that can't be reached properly if using the view finder.
9.0|#|nicelycompact fr a24x zoom camera.   never beendisappointed with Panasonic.|#|None
9.0|#|Very manageable with sufficient features to ensure that whatever your experience you will capture excellent images|#|rather on the heavy side
10.0|#|great lens, easy to use top plate dials, easy to navigate menus|#|haven't found anything bad yet.
8.0|#|I've just used it for two weeks intensive use on holiday in Greece, along with my Lumix G1.  It's a very versatile camera and intuitive to use.  The zoom range is fantastic and it is a quality lens.  Overall a very good camera.|#|The viewfinder could be improved, like the Lumix G1 and the contrast focusing is a bit slow for action shots.   I think a software download will follow, as it seems to lock out of focus sometimes and you have to turn it off and back on to correct it.
10.0|#|Excellent zoom great picture I won't use any other make 3rd lumix camera I've purchased.|#|operating menu could be easier to use takes getting used to.
8.0|#|ease of use, compact and lightweight, excellent image quality, range of presets and manual operation, simple point and shoot capability ma grannie could use!|#|No rubber eye piece
10.0|#|Fast 'wake-up', fantastic zoom, excellent 'burst mode'.  Screen much better than earlier models.  Super pictures.  Overall excellent value.|#|A lot of buttons in quite a small space.  Menus for the sake of menus, sometimes ? - stick to IA setting
8.0|#|Zoom, articulated screen, size, supplied lens hood, hotshoe, 11 FPS at full resolution inc. RAW!|#|when camera switched off. Low ISO photography not as good quality as previous models e.g. FZ-28 (IQ suffers).
9.0|#|Just a great all round camera, particularly for the proce I paid for it. It does what it says on the can!|#|
9.0|#|Nothing so far!!|#|
8.0|#|Clear adjustable LCD screen. Impressive zoom. Light, compact.|#|No complete paper manual. Switching settings modes complicated.
9.0|#|Light and easy to use with good image qualty for the price.|#|Haven't found any yet.
10.0|#|Everything|#|Nothing
9.0|#|Very good value for money. excellent images and good video|#|none.
9.0|#|Picture quality is excellent|#|Tripod location is not lined up with centre of balance - but I haven't seen one one superzoom that is.
10.0|#|options. Complete versitility...best camera I've had.|#|Sometimes can take a while for the flash to warm up again.
9.0|#|Overall very good camera|#|None
10.0|#|I have not explored all the other features, but they seem relatively easy to use, even for me, and the buttons are all well placed.|#|I have to remind myself to switch off when I have finished using the camera.   Also  have to be careful with the lens cap if  I don't want it to come off in transit.
8.0|#||#|cd fine but would like a comprehensive handbook too
8.0|#|A good camera for experienced amateurs.|#|Fairly expensive compared with FZ45.
8.0|#|good quality amazing zoom|#|
10.0|#|The camera was bought for my father who had a FZ38 and wanted to upgrade and has found the facilities and the image quality signicantly better. He is in his 80s and found this camera comprehensive and easy to use.|#|None so far
7.0|#|very light . Good lens|#|Lack of instruction manual
9.0|#|Versatility, build quality and intelligent Auto setting|#|night pictures too grainy
10.0|#|Great size/weight/zoom/ anti-shake and most other features|#|
9.0|#|The Panasonic Lumix DMC-FZ100 is a great camara for any one trying to up grade from a compact camara but who is not ready for the all out cost our experience of an SLR.|#|Found the camara body a little plastic
10.0|#|Fullfill any need concerning photography for amateur.|#|
9.0|#|Very good overall performance|#|None so far
10.0|#|covers all my needs - stills and videos in same session without any resetting|#|not found any yet
9.0|#|Wonderful zoom|#|No printed full manual, only on CD
10.0|#||#|No french
8.0|#|nice and simply camera|#|
7.0|#|I have taken some stunning pictures in the last 3 weeks using the 'super zoom' but I still haven't got the hang of good shots every time. Once I have got used to AF and all the other variables I will write another report. All in all I think this is the camera I wanted. Haven't tried Video yet.|#|No bad points other than it would have been nice to have somewhere to stow the lense protector when not in use and a wider, padded, neck strap.
10.0|#|i love it|#|
10.0|#|A great camera|#|Let down by the DC Coupler not available
9.0|#|compact, light. Good range of lens. Simple to use.|#|Supplied computer software could be better. Very limited.
9.0|#|Having used a Panasonic camera before, I was looking forward to this one. I have not been disappointed. Although I have only been using it for a few weeks, I am very pleased with it. It is as easy to use as you wish, but also gives a full range of manual options if you prefer that route. Not as heavy to carry as a conventional DSLR, but nicely weighted, feels just right. Glad I decided to purchase, and definately recommend.|#|Lens cap fiddly to get off when the hood is fitted.
10.0|#|Very good images, easy to use for someone who is not by any means a professional.|#|Haven't found any yet.
3.0|#|The zoom is incredible but thats it.|#|Very expensive for what you get, sadly the build quality is really poor, its very very fisher price plasticy. The grip had already come off. The rear lcd panel doesn't match the finish on the body and i suspect its from another camera in a different series. Also, if you google the camera there seems to serious issues with it at high ASA's...you will only be dissapointed with this camera
9.0|#|I've moved on from the FZ7 so that must be recommendation in itself. Not encountered any bad points other than having an on-line instruction book. Not very practical, and too many pages to print off.|#|
4.0|#|the zoom is quiet while filming|#|Very poor build quality feels extremely plastic. The noise in the photos appears as soon as soon as the 10x zoom is used which makes having a 20x zoom pretty pointless. I particularly found pictures in low light apalling.
9.0|#|not used it enough yet will let you know soon|#|no bad points as yet
5.0|#|Excellent features, zoom and high speed burst mode.|#|The 60 fps burst mode is adequate.
9.0|#|It's a great travelling companion,nice and solid,but not too heavy on the shoulder!|#|
8.0|#|looks good and feels good and with a proper instruction manual i feel sure I would be well satisfied..|#|Terrible Instruction Manual.
8.0|#|Easy to use, quick and easy set up, good quality images|#|Assume levels of knowledge on main instructions, if you dont know what half the terms means it ishard to understand what the camera does.  This is not alone with this product but a fault of manuels world wide
10.0|#|easy to use,compact,build quality first class|#|needs a printed handbook,one is provided on dvd but thats not much use in the field
9.0|#|super-zoom ,52mm filter capability,hot shoe.|#|not true manual focus.
9.0|#|Great  picture quality and easy use.|#|None.
10.0|#|Ease Of Use|#|None I can think of
8.0|#|Light, easy controls, user friendly.|#|Image quality OK, but not outstanding.
9.0|#|The 24x  optical zoom is the stand-out feature, as well as the full HD video function|#|The video record button is not easy to locate when you want to stop recording. Perhaps it's a question of practice. On a recent occasion when the weather conditions were wet and windy (but the temperature 14c) the camera wouldn't respond when the shutter was pressed and I had to reboot. I have to see f this repeated.
10.0|#|Great little camera..|#|Nil
9.0|#|A great 'bridge' camera. Excellent - 24x  zoom,  a viewfinder and a 'swivel ' LCD. It also has a hot shoe|#|No lens cap 'holding point' whilst detached from lens.
9.0|#|lA PUISSANCE DU ZOOM|#|JE L'AI TROP PEU UTILISE POUR TOUT JUGER.
9.0|#|Easy to use|#|Pictures in Low light
7.0|#|ease of use picture quality and value for money|#|
9.0|#|Excellent camera, easy to use with plenty of features. Zone facilty exceleent.|#|Lens hood keeps falling off.
9.0|#|very good quality for very good price|#|nothing
9.0|#|shoot when you want ... then really comes alive with the built in advanced features for those special pictures without all of the hassle of carrying lots of extra lenses and equipment or missing the shot changing components|#|Not a true DSLR .... but then as an introduction unit to more serious photography no real issues
9.0|#|Easy to use, brilliant pictures, loads of features.|#|none yet!
10.0|#|wonderful product at the right price|#|none
9.0|#|Excellent wide angle and powerful zoom all in one camera.  Incredible macro.  Self-portraits a doddle with swivel LCD.|#|Poor manual.
9.0|#|easy to use|#|have not found any yet
9.0|#|Lovely light-weight camera, easy to use, great picture quality (even when zoomed in without a tripod). Great on video mode too.|#|Lens hood does not fit. Am in touch with Dixons to see if I can get a replacement.
10.0|#|Amazing zoom. Full HD recording.|#|
5.0|#|Not applicable really|#|Not applicable really
9.0|#|Excellent optical, zoom 24 from f25, plus double (in fact only 1.5 with the new mounting). Passing from a very good FZ30, it's lighter, smaller and better.|#|Not yet....
10.0|#|Excellent piece of kit. Beautiful quality lens.|#|None.
9.0|#|Panasonic build quality, excellent Leica lens.|#|
9.0|#|Good camera....focus fast...easy to use..|#|wish the manual was printed instead of on CD
10.0|#|I find this camera relatively easy to use, compared to some camera's.|#|Price of extra battery. In fact still looking.
9.0|#|Excellent build quality...loooks great!|#|can get it to go onto auto flash but the flash wont pop up by itself?...is it supposed to?
9.0|#||#|Bad:  nothing
10.0|#|Fantastic camera, configureable, nice to hold, great picture quality.|#|
9.0|#|Pretty good optics.|#|Size, a little bit too thick, hard to carry in pocket
9.0|#|Great size and build quality fast start up n lovely images|#|Power zoom is expensive flash is weak but acceptable for my use
8.0|#|Standard Japanese lens a good start point.|#|Loose and easily lost lens caps are still not acceptable
9.0|#|With the pancake lens it becomes effectively a pocket-sized camera.|#|Takes a while to find your way round some of the features.
9.0|#|16 Mb CMOS Sensor - controls and handling the same as GF-1.  Takes existing lenses.|#|Adjustment of aperture and exposure rating on same control - not amenable to quick actions.
10.0|#|I have to admit that I'm a bit of a learner and have arranged with the Irish Photographic Society to take a course in digital photography, hence my scoring it only 5 on 'Ease of Use' in your survey.  However, I bought the camera to stretch my knowledge and hopefully take better pictures evetually.|#|I haven't found any!
10.0|#|Solid build, nice comfortable weight , well appointed fatures|#|
8.0|#|size, features [photographer has a lot of control]|#|
8.0|#|Compact and light. I bought it to take photographs of cats needing homes. My old HP compact and my Nikon bridge camera only ever managd to get a retreating bottom. Now I get a face when I press the shutter. It takes good photograhs too.|#|Some may think this is a good point, but to me it has too many features. I would prefer a simpler system with an instruction book rather than having to go on line.
10.0|#|Excellent picture quality lightweight and small perfect.|#|so many buttons on it and in the quick start quide the picture of the camera with all the numbers on the buttons is on the right hand page so you have to turn over to see what the numbers mean and you are flicking from page to page, would the nice if they were on the same page or opposite facing pages.
9.0|#|Easy to use and good quality with a cheap price!|#|Slow for multiple photos.
10.0|#|Simple and easy to use. Feels comfortable to hold and has a lovely big, clear LCD monitor. Instant take after pressing the shutter button - not like my Fuji camera which had a delay on it, by which time the subject had moved!!!! - an absolute nightmare! Very happy so far.|#|Not found any yet.
10.0|#|Light and easy to use. Has separate video button rather than having to change settings.  Good zoom.|#|Has less scene setting than my previous, older Lumix.  Having to charge the battery in the camera is not always practical
9.0|#|Very impressed.|#|
10.0|#|I am still working on this camera-but so far have found it fulfils all I expected of it|#|
9.0|#||#|* could have had a better printed manual than all on disc
9.0|#|Lightweight, very good number of features for a small camera, excellent image quality even under difficult circumstances.|#|
10.0|#|great little camera, compact and easy to use, like the panoramic view feature.|#|
5.0|#|Good small Digital Camera|#|Not value for money
8.0|#|Small and light, good value for money, main features easily accessible.|#|None evident so far.
9.0|#|easy to eset up and use|#|non that I ould find.
7.0|#|light, easy to use, good quality pictures for the price|#|flash a litte weak
9.0|#|nice sturdy camera.  not a cheap feel like others of a similar price.  zoom is fab!  I'm sure that the other features will be fab too but haven't worked out how to use it properly yet!|#|cd for the manual is bit of a pain so truth of the matter is we haven't actually used many features yet as we haven't uploaded cd!
10.0|#|best price i could find for this camera, lots of features, easy to use.|#|None so far.
10.0|#|small, fun, discreet for street photography.|#|W processing - or at least if there is I haven't found it!
10.0|#|Great little easy to use camera with an excellent video|#|
9.0|#|video easy to use|#|easy to accidently switch it on in your pocket
9.0|#|and she was thrilled to bits.|#|None as yet.
8.0|#|light and compact|#|not having an instruction book within the box
9.0|#|Very pleased with ease of use, good quality in all aspects as expected|#|None found yet!!
9.0|#|Well built, good size weigh nice compact camera great to take on holiday|#|retractable lens
10.0|#|Takes great photos.|#|Battery doesn't stay charged for long.
8.0|#|Takes good clear photos|#|the fact that it has no view finder is a downer especially in the sun.
9.0|#|Excellent quality photos in all sorts of conditions and a good battery life, all in a very slim and smart case.|#|None.
9.0|#|Great camera for those who don't like to bogged down with too many features. Excellent photo quality. Easy to use.|#|Could do with a close-up/ macro setting.
9.0|#|Good camera and easy to use|#|Lack of printed basic instructions. Not available when needed on holiday
8.0|#|ease of use|#|info book not very clear just pictures
9.0|#|Compact with good zoom and image quality|#|
10.0|#|Easy to use.  Good sized screen.  Fits in pocket.|#|
8.0|#|easy of use simple|#|small very easy to lose out of pockets etc
8.0|#|Large display.|#|Some functions confusing to use.
10.0|#|SO EASY TO USE ...JUST POINT AND SHOOT|#|
9.0|#|It's a great little camera, think it's about the 3rd or 4th lunmix we've had|#|it's a shame one can't zoom in and out when using the panorama function
10.0|#||#|none
8.0|#|Easy to use, nice pictures|#|
9.0|#|lots|#|hardly any
8.0|#|easy to use|#|-
1.0|#|Very compact and easy to slip in a pocket.|#|
9.0|#|Good specification|#|Difficult to see screen in bright sunshine
9.0|#|Ease of zoom. Big view finder.|#|None yet
9.0|#|Almost instant shutter reaction, good quality for family/holiday pictures|#|none so far
9.0|#|Build quality and value for money!|#|Access to full use instructions could be easier simpler to obtain say within camera set-up.
10.0|#|easy to use video easy to review pictures easy to use|#|slightly awkward to find some features in the menu
10.0|#|fairly easy to use and good quality photos|#|hard to see screen in sunlight
8.0|#|Compact size, easy to use.|#|None that I have yet discovered.
9.0|#|I have only had the Lumix a month and and still familiarising myself with its applications .|#|None so far .
10.0|#|Very portable due to being lightweight and very compact. Takes good pictures. Very easy to slip into yr handbag.|#|Would have preferred more detailed handbook to accompany the camera rather than having to look on the Internet.
8.0|#||#|Average low light performance
9.0|#|Does what it is suppo|#|Doesn't work properly with some of our software!!!
9.0|#|Good user interface. uncluttered layout.|#|None really, at the price.
10.0|#|appearance|#|have not happened yet
9.0|#|Capable of high quality stills and HD video|#|As a new owner, I find Photofun studio difficult to use. Particularly hard to save items safely to computer - as a result I have lost a video I wanted to keep.
10.0|#|Idiot proof !!!|#|
10.0|#|good all round camera perfect for my needs|#|
9.0|#|Easy to use|#|None
10.0|#|very easy to use|#|
9.0|#|plenty|#|none
10.0|#|This is my first m4/3 camera.  I have canon EOS 40D with many lenses.  GX1 is very compact and responsible.  AF is very quick.  It may be as fast as EOS system.  The power zoom is also impressively compact and small.  I can now carry camera around without any hustle.|#|I felt Panasonic could improve a quality of details a little bit more. Also they could have improved the sensor to match with competitors. But these are very minor points and nothing serious.
10.0|#|X lens is terrifically handy as it does exactly as the manual lens but more compact and fits in ALL the pouches for GX1; no need for extra lens bag|#|None (initially)
10.0|#|J|#|
