10.0|#|shoot, but nothing too complicated, and this certainly fits the bill! I wish i'd bought it earlier for my trip to New York as I could have taken some beautiful photographs! I'm going to Australia though soon so this will definitely give me the photographic memories i'm hoping for!!!|#|I've not found anything bad about this camera yet!! :0)
10.0|#|everything|#|none so far
10.0|#|easy to handle. A good all round camera for the beginner with plenty of extras for the more professional user.|#|
9.0|#|Good all round camera, with plenty of functions for enthusiasts. good for aspiring photographers.|#|havent found any yet
9.0|#|John|#|) but unless you intend to blow pic's up to seriously large sizes, it really shouldn't bother you too much.
9.0|#|Great value and great features.|#|N/A
9.0|#|Very impressed with this camera, chose this over the FZ45 after reading reveiws. good build quality, plenty of features and picture quality in JPEG good. Can't comment on RAW. Image stabilisation on maximum zoom very good.|#|None found yet
10.0|#|Fantastic bit of kit, set to automatic mode, zoom,point,click...simples.....and for you boffins out there, thee is lots of other options for you to try and play with|#|
9.0|#|Excellent anti-shake, good quality lens, great zoom, light weight|#|Too big for a shirt pocket
8.0|#|excellent image quality , ease of use|#|none
10.0|#|Ease of use,light weight and excellent quallity of images.|#|Camera strap could be more robust.
10.0|#|It is small, light, has an extrerely long tele facility and a very reasonable wide angle. I print mainly A4 size and the quality has been extremely good.|#|None really. People with very big hands might find it slightly fiddly. The instruction manual is extremely brief - 60 pages less than my FZ20 but it does come with comprehensive instructions on a CD
10.0|#|i think is one of best camera in market and best picture quality|#|
9.0|#|Lightweight and very quick start up|#|Working through the menus and remembering which options are allowed.
7.0|#|nice looking camera, takes pictures quicklu no need to wait for it to load.|#|Imae quality is poor, hard to focus colours corecctly as currently blonde people come out in pictures as strawberry blonde.
9.0|#|Compact. easy to handle|#|view finder LCD monitor  not flrexible being fixed
8.0|#|Really good - natural colours in terms of picture quality. Video good and sound loud enough. Excellent battery life.|#|None major bad points so far...
9.0|#|it certainly does what it says on the box but...|#|setups. Also, it has a habit of ignoring some of your settings and introduces some of its own defaults, which sometimes affect the result you were after or else are just an annoying intrusion. A regular user would eventually get accustomed to its idiosynchratic nature, but a less regular user would have difficulty in remembering what's what.
9.0|#|GReat Camera. Takes lovely pictures. Loads of settings which I havent worked out how to use yet. Great High Def video with HDMI socket. Better than normal digital cameras.|#|Only small gripe but its onlty a small one. No proper camera case so you just have to find one thats fits
9.0|#||#|It has little internal memory. It has been discontinued
10.0|#|Picture quality is very good, backed up by a very long zoom. Did not think I would notice such a big improvement over my, Lumix 10x zoom TZ 2.|#|Somewhat bigger than my TZ 2, wont fit in my pocket.
10.0|#|everything is adjustable its amazingly complicated but quite rewarding. A perfect starter digital SLR|#|not for the faint hearted
7.0|#|I cannot much about the machine, because I am very inexperiente and feel that I need some courses/book.|#|Cannot see any.
10.0|#|Generally enjoying my Lumix very much.|#|Would have appreciated a printed instruction manual to have with the camera at all times.
9.0|#|Still getting my head round the manual part but my images are improving every time! Great image quality.|#|some of the modes e.g. night mode automatically compensate image quality.
9.0|#|Quite easy to use but needed to refer to the manual which is only on CD. Considering I took it out of the box and played with it before reading anything, the pictures were much better than my one year old compact. Fantastic size, not to big or bulky. Can do so much with it and looking forward to taking it to Egypt later in the year.|#|Manual only comes with on CD so have to boot up laptop each time to read up on it, minor niggle.
10.0|#|Quality of still shots|#|Nothing yet
10.0|#|Its a great camera to handle. Focusing is excellant|#|Have not found one yet
10.0|#|Very easy to use and understand.  Perfect bridge camera.|#|I guess the only thing might be the little joystick to change apeture and shutter speed.  A little bit fiddly.
1.0|#||#|Just found out after buying it that this model is discontinued. I would have been far happier to buy the latest model even if the cost was higher! (Within reason.)
9.0|#|Good pictures, and great HD video|#|
9.0|#|At first if you do not understand all the functions which can take time to get used too just use the auto-focus which takes great photos.You can then start using the manual features at your leisure..The camera looks like a top of the range expensive one because of all its features but for someone to move up from a pocket digital and do not want to spend hundreds on a SLR and end up confused this camera for me ticks all the boxes.|#|the intelligent auto focus produces great shots.
9.0|#|Photographs so far appear to be crisp and clear.|#|Would have been nice to have a manual incuded.
10.0|#|I upgraded to this camera from a Fuji finepix but didn't want to send a lot.  I have read lots of excellent reviews and I've not been dissapointed.  Its easy to use and can be used as a point and shoot if thats what you want.  I wanted to start learning a little more about the techincal side of photography and have found it easy to apply to this camera, on the semi-auto settings and on the fully manual settings. Overall I'm really pleased with this camera and would recommend it to anyone wanting to get into more creative photography without spending a fortune.|#|
8.0|#|use own settings. Excellent battery life.|#|
9.0|#|EVERYTHING|#|NOT FOUND ANY YET
10.0|#|Info on screen when changing to a different setting is a huge help if like me you're not technically minded.  Love everything about it, easy to use, not too heavy, nice to have choice of viewfinder/screen especially when it's really sunny.|#|Not found any
9.0|#||#|so sometimes it takes a long time to get the correct setting
10.0|#|Image quality is fantastic. You can take great professional looking pictures. Lightweight despite size. Good value for money|#|Only one - due to size means I have to take a larger handbag on nights out to accomodate the camera.
9.0|#|Weight,easy to handle.|#|Time taken inbetween shots slower than expected
10.0|#|Picture quality|#|No printed manual
10.0|#|Lovely camera, especially as I am used to a DSLR (which this cameras pictures compare to) Light weight and easy to use functions. Easy to set up on the PC and upload pictures. Auto intelligent setting is fab, quite a few settings for various conditions and love the baby mode.|#|Only one battery supplied which is a shame.
10.0|#|Fast startup. Strong design and great build quality. Awesome zoom. Great pictures. Compact for a DSLR/bridge. Great video.|#|Indoor iso/flash use not great but `OK for a bridge
9.0|#|very good point and shoot camera with many other features - still working my way through!! excellent value and a great bridging camera. image quality is great and the camera is very easy to use - especially on intelligent auto. stabilisation seems good, start up time and repeat shot is excellent - generally very pleased with the Lumix|#|auto focus on the video side can be a bit annoying as re-focusses and can blur moving images
9.0|#|Superb zoom quality, fast autofocus.|#|Complex documentation.
9.0|#|Easy to use Good life in the rechargeable battery. Good range of accessories. .|#|
10.0|#|The nearest thing to a SLR without being one.|#|No screen protector for the LCD display - but got one of ebay.
10.0|#|Very good battery life.|#|Expensive macro and tele lenses.
9.0|#|Controls easy to use and plenty to explore and experiment with as confidence grows.|#|Some indoor and low light shots need a bit more effort to get right.
10.0|#|Excellent point and shoot camera with fantastic results, pictures are sharp and bursting with colour, loads of easily selected modes for outdoor / indoor, portraits sport etc. Intelegent auto takes brilliant photos effortlessly. Powerfull flash with red eye reduction and excellent HD Video thrown in too. Using this as a stepping stone to the bigger digital SLR cameras but to be honest this has it all..... fantastic value.. highly recommeded, this camera will not disappoint!|#|Cant think of any!
9.0|#|Small and easy to carry around, does everything you want it to do. Very good value for money and really pleased with it|#|Some indoor shots not as good quality but easily solved with playing around with settings
9.0|#|Easy to use had previos model this one better|#|
9.0|#||#|Camera lens cover has to be removed even if viewing or transferring images/videos
9.0|#|I haven't had that much of a chance to use it yet only taken about 150 images in a few different modes and all seem to take a good picture, still have a lot to learn about the camera but so far has some great features and looking forward to using a few more of them.|#|not found any yet
10.0|#|Loads of features|#|Nothing yet except lack of carrying case
9.0|#|I'm just a novice but, this camera is so good even I can take brilliant pictures.|#|
9.0|#|Good picture quality. Easy and quick to use. Few hours play without reading manual and you are an expert. Battery and charger is a great idea.|#|Menu is not best quality and sometimes confusing. Could have spare battery that could help in long trips.
10.0|#|Although it has a very efficient automatic program, you can also progressively use it more personnaly. A good transition to the reflex camera.|#|
10.0|#||#|THE FACT THAT THE NIGHT VISION IS NOT BRIGHT ENOUGH I.E. I AM NOT ABLE TO USE THE FLASH AS WELL AS THE NIGHT VISON AT HE SAME TIME... COULD I GET HELP WITH THAT??
10.0|#|Very easy to use, great image quality, considering all features really good value for money.|#|In manual mode you do seem a little limited as to aperture settings etc at slow shutter speed couldn't set aperture of say f16 or higher. But need to have a better play as may be able to get round this.
10.0|#|So far, the quality of the photos are super fantastic, the battery seems to last for ages before needing charging. There are so many features I keep coming across which is fun to use.|#|
9.0|#|The camera is pretty simple to use after a short time, and very effective for good quality pics.|#|Too bad it doesn't come with a carry case....
10.0|#|Ease of use and very light weight.|#|None
9.0|#|Performance plus build quality, but see below|#|However, I appreciate that some people would regard the light weight as an advantage.
8.0|#|understood all the functions VERY pleased.|#|snap' digital cam.
10.0|#|Lightweight camera that produces pictures of fantastic quality. Have never had so many comments on my photos!|#|
9.0|#|I also do a lot of product-shot photography for web use and for this it is perfect.|#|Noise at high ISO levels is inevitable with small sensors, as is a cropping at wide angles but it's still a great camera.
10.0|#|Still getting used to it but I've not had any bad experiences yet.|#|IThe manual is awful...please, I want a book!! Not a disc!
9.0|#|Excellent lens, easy controls, clear rear screen and a viewfinder (so, so useful in really bright circumstances.|#|Far too clever for me --- too many options so most of the time I let the camera do its own thing (Intelligent auto -- unlike the owner)
8.0|#|Camera fantastic case fantstic|#|one leg will not hold stable
8.0|#|Amazing photos and ease of use. LCD display is excellent|#|Has a weird almost toy camera feel to the build of the product, plasticy, but does not detract from the quality of photos
9.0|#|Cost, good picture quality, versatile mode settings and robust build - it's been up a few mountains now and is still in one piece!  Overall a very good purchase.|#|Only x18 optical zoom
9.0|#|camera and its capable of taking fantastic pictures. Its really easy to use, bright screen and excellent Video recording.|#|
5.0|#|nice and lovly body|#|picture not clear as i expected
9.0|#|very easy to use, point and shoot works well, and other features reasonably easy to access|#|it is irritating to have to use a ring to fit the lens hood and there is no zoom feature whilst recording movies
8.0|#|Light weight. Logicak controls. Ease of use.|#|Focus is very slow, and does not work well with zoom.
10.0|#|Superb lens, lightweight camera, fantastic zoom.|#|None!
7.0|#|As a camera novice (I've only had little digital idiot proof cameras before) this was a big step - use is easy and the zoom is fab|#|size-too big for handbag
9.0|#|A good Bridge Camera|#|
9.0|#|Only had the camera 2 weeks so still learning but it is really easy to use as a beginner, Im very pleased with it so far.|#|Still to find them!
8.0|#|Good all round camera - very flexible|#|Complex instructions - very voluminous
10.0|#|Ease of use and quality|#|Difficulty in getting accessories
10.0|#|Everything, we are delighted with this camera . . . . . . .|#|however, the only bug bare is it hasn't got an automatic pop up flash, other than that its brilliant would defo recommend.
10.0|#|Easy to use great pictures and i am really happy with the camera very good value for the money|#|Not a fault just wish it had better macro lense
9.0|#|My ratings are not the most reliable since the purchase was a gift for my wife, but she seems thrilled with it and has taken some excellent pictures with it.|#|
9.0|#|Picture quality,Decent size zoom lens.|#|None so far
9.0|#|The camera was recommended to me by a professional photographer friend of mine who had assessed the 'bridge' cameras currently available and I am very happy with his choice.|#|
10.0|#|See above|#|Instruction manual, too complex.
8.0|#|image quality|#|- otherwise a superb camera at the price
10.0|#|great quality on video clips|#|none
9.0|#|Excellent all round features|#|None that I can think of....................
10.0|#|easy to use, good in every way,  best camera ever brought ,value for money, very pleased with camera would recommend it to any one|#|none found
10.0|#||#|Not found any
9.0|#|Very good compromise between SLR and compact camera.  Basic features verr rapid and easy to use.|#|More advanced features, and there are many, can be very complex to set up.  However, generally worth it overall
9.0|#|Easy to use....better picture than a compact camera. Good zoom. Nice rechargeable battery with lasting power. A good choice for some one who cannot afford a DSLR. Good video at 720 p HD. Nice sound capturing.|#|Shooting video hand held could result in shaky video. Image stabilization needs to improve a lot.
9.0|#|I am still learning to use it but so far I am well inpressed with all its features|#|
10.0|#|all is well|#|I think you should have had a touch screen in this.
10.0|#|very light but still feels well made, excellent images and features. leave it in intelligent auto for ease of use or use other settings if you want to play around and experiment. bought it just for the camera but the video is fantastic too. easy to use, my wife and 9yr old daughter think it is great to use.|#|???
9.0|#|Qualite des photos,rapidite entre prise de vue,meme en interieur,poid tres resonnable,excellente utilisation meme pour un debutant,autonomie de batterie tres confortable.|#|Je n'en ai trouver aucuns
10.0|#|Really easy to use great buy. Brought as xmas present really pleased with zoom|#|Not found any as yet
9.0|#|This camera captures brilliant still photos and videos are amazing aswell.|#|
9.0|#|Image quality, speed|#|None
9.0|#|A good allround camera which I have reccommended to others.   A lot to assimilate but no doubt continual use will help.|#|
8.0|#|Good product, very good quality of picture, and easy to use.|#|
9.0|#|Build Quality, Image Quality|#|None I can think of
9.0|#|not too heavy, plenty battery power good focus|#|bit slow to use on flash -miss the shot
9.0|#|Its compact, large lcd screen, HD video 720p...looks great|#|Not the best instruction manual
10.0|#|Excellent camera,light, plenty of features and easy to use.|#|None
7.0|#|wide focal length range. compact size|#|electronic viewfinder
10.0|#|good quality caseing, very good images, pretty easy to use.|#|
8.0|#||#|W effects.  Overladen with features, some of which I may never get around to using but picture quality is sooooooo good, and I'd rather have things I end up not using than find it comes up short.
9.0|#|small and light, fantastic value for money, this is my first panasonic camera i usually go for sony, but i read the other reviews and i am not dissappointed at all. there is a feature for all events. the camera is light the pop up flash is a very useful feature. would recommend this camera.|#|the only bad point i can find with this camers is that the paper instruction booklet that comes with the camera  only covers the basics. the full instruction booklet is on disc.
9.0|#|Light Weight easy to use with enough features and maual controlls to keep the serious amateur happy.|#|
9.0|#|Exceptionally good value for money|#|video software could be better
10.0|#|it's just SO easy to produce good images - quickly. If only the shutter was as fast as an SLR it would be Utopia!! G 11/01/1956|#|
9.0|#|Great camera, for a great price.|#|
10.0|#|Wonderful zoom, excellent image quality and very good screen|#|Rather bulky
9.0|#|Good quality feel, the HD video is excellent and I am very pleased with the overall results.|#|the jury is still out on this.
9.0|#|amazing zoom - clear pictures in low light at the maximum zoom.  great pre-set modes and full manual if you need it.|#|
10.0|#|Many|#|None
10.0|#|Very easy to use|#|None
9.0|#|Easy to use for those unfamiliar to gadgets|#|none so far
9.0|#|all good|#|none
8.0|#|Touchscreen, slim design, very good in low-light conditions|#|Unable to zoom on video recording, poor sound quality on video recording
8.0|#|Easy to use, good quality and for an average photographer it does everything you want. The price is about right for this type of camera|#|The touch screen could be improved as it is rather slow to react and a little confusing.
10.0|#|Compact camera. Good design. Great price.|#|Touch screen scrolling between photos can sometimes be tricky, however the camera represents excellent value for the quality provided.
9.0|#|And if you want to play about with it its great fun,the touch screen is good and fun to use|#|only had it about 2 weeks and none so far
7.0|#||#|battery to low
9.0|#|It's very easy to use, good quality picture, and very small, so youu can take it wherever you want easily|#|But I don't do that, I wath the photos on my comp, so there isn't this problem
10.0|#|Great camera for the price.|#|Not full HD, video recording limited to 2gb chunks.
8.0|#|High quality video and good image definition|#|Solwly shutter speed, so you can't take pictures to medium-high speed.
9.0|#|My first experiences using the camera have been positive.  I haven't used it enough to award a 10 in each category however I found the menu system very easy once I had taken a few minutes to study it.  The picture quality is extremely good and the camera is small and compact.  Opening and closing the lens cover is a novel way of turning the camera on and off whilst protecting the lens and I like it.|#|Not really a bad point just different from what I have been used to. Haviing to remember to press the iA button on top of the camera before pressing the shutter button to take an automatic picture.  I'm sure in time I will get used to it.
9.0|#|I already owned a Lumix and so did my husband. He had his stolen and so I replaced it with the FP3 for Xmas. He used to be a professional photographer and is quite particular about what he uses. The Lumix has a Leica lens. The FP3 is ultra slim and can fit in a top pocket - which is why I chose it. Means he can have a decent camera with him wherever he goes. It has a large display screen and intuitive menu.|#|The touch screen is very appealing but can be slow to work and sometimes needs repeated tries.
9.0|#|Easy to use point and shoot camera with good quality pictures and build quality, even the most techno feared person can use this camera.|#|Because of its size and style the zoom capacity slightly lacks clowt
9.0|#|Large viewing screen|#|Takes a long time to view multiple pictures
10.0|#|Excellent camera.very impressed with quality photos and ease of use.lots of features with easy understanding touch screen apps.excellent battery life.|#|No bad points
8.0|#|Easy to use|#|Nothing
10.0|#|The slide show feature with music and the speed at which it takes a photo. All the amazing different image options. Compact and user friendly you really don't need to look at the instructions to know how to do most of the things you need|#|None what so ever. the touch screen wouldn't work with my fingers at Christmas taking photos outside, however I think this was because it was about minus 10 degrees not the cameras fault.
9.0|#|well designed.|#|Haven't found any so far.
9.0|#|Front  flap very handy for on/off function.|#|
9.0|#|Clean mean light machine , fast shutter , that's what I wanted . I'm very pleased with it.|#|While carrying the camera in your pockets ,it opens the lens too easy , probably it shuts it down , I hope
10.0|#|Easy to use, compact , looks good. High quality photos|#|No facebook quick upload
10.0|#|Bought this camera for my grand-daughters 21st and she is delighted with it. she wanted a camera for essential use relating to her university. This is the camera I would buy for myself!  I was talking to her last night and she has already posted some of her pictures on a social networking site having used the camera for both work and pleasure. She said that it's brilliant for taking a 'quick opportunity' snap as it does all the work for you with the auto setting. I have recommended this camera to a friend for both excellent features and excellent value for money.|#|None as  yet.
9.0|#|It is an amazing little camera - great battery life - easy to use menu - very quick response - short shutter lag|#|no in-car charger
8.0|#|The fold out touch screen viewfinder is more than just a gimmick, it really does give you more control. The camera is surprisingly light in weight and controls are positioned perfectly (as long as you're right-handed!). The flexibility of shooting stills or HD video with the same unit is valuable when touring. It comes with a proper printed manual, you don't have to download and print a pdf at your own expense as so often nowadays.|#|The zoom action of the standard 14-42 lens is not as smooth as I would like and I'm not sure how durable the plastic mount is going to be. The built in flash is little better than useless, but there is a hot shoe for an accessory flash. There is no accommodation for a cable release which I would have found useful.
9.0|#|The twin lens kit comes with lens hoods which can be reversed and securely stowed on the lens and also individual lens bags which I thought was a nice touch|#|Spare batteries have to be Panasonic batteries as they are 'chipped' and thus they are three times more expensive than alternative makes.
9.0|#|Very light to handle, with either lens. This is particularly useful to me as I find the heavier cameras create more camera shake, especially when using a telephoto lens. I like the size also.  Probably men with larger hands might find it too small to negotiate the controls, but being a woman with smaller hands, I found it to be the perfect size for me.  The menu is very user friendly and simple to negotiate. Very good for the amature who likes preset menus, but also very good for the enthusiast who like to do the manual thing.  I particularly love the swivel back screen as safety for the actual screen as well as for those awkward shots.  I'm not too tall so I can hold the camera higher and still what I'm taking.  The same applies to low to the ground shots.  Especially if kneeling or lying down is not an option!  The controls are placed really well and easy to locate.  I like the material the camera body is made of.  It helps with grip.  Overall, I'm really happy with it.|#|There's a bit of a lag in shutter time between shots.  But, given the overall good points, I'm prepared to put up with this.
10.0|#|videos even in low light conditions.|#|button to release in small gap, makes release tricky if you have large fingers.
9.0|#|High quality images lots of good features on stills and video, light weight|#|Can be a bit complicated for a beginner
10.0|#|Size reduction, much lighter in weight - comprehensive addition of 'extras' with many other cameras. Performance is something yet to determine, but the Panasonic name must infer excellence.|#|Too early to make much comment, but the camera book is not very well laid out as some other (Canon) makes are, and it is rather more of a battle to understand the basic layout and operations - but perhaps time will pay-off on   the study part - especially for those moving up from the more simple point-and-shoot cameras.
9.0|#|takes high quality video and the flip out screen is useful.|#|menu navigation in a bit cumbersome.
9.0|#|For the beginner, this is a very good starting camera and the Manual is very simple to use.|#|The only bad point of the design is the position of the lens release button.  When holding the camera ready to take a picture, the button can be accidently pressed.
