10.0|#|Small but wide angle + HD movies + stabilizator + good lenses|#|
9.0|#|Face recognition|#|. I would prefer loading direct into the camera (as my 8 years old Sony dsc already did)
9.0|#||#|Have to remove the battery to charge it
10.0|#||#|no bad points
9.0|#|fits in pocket|#|none
9.0|#|good picture  , easy to use , small size ,|#|see subject
5.0|#|Good quality with many features, start up and picture taking times excellent.|#|Image quality poor - excessive noise at all ISO settings, older and lower spec cameras can do a lot better.
9.0|#|Very compact but still has performance of a larger camera. Good image quality and stabilisation even on extended zoom. Easy to use controls.|#|Some parts of instructions ( on CD) not that easily understood.
5.0|#|Small and light for what it does - seems to be made well, it functions!|#|Ken
10.0|#|Good point and shoot and I like the burst, and the trimming feature.|#|Would prefer to have an instruction book as opposed to having to download. Some of the instructions are not basic enough for me as I am not technically minded.
9.0|#|Versatile, compact and an easy to follow menu structure|#|Very expensive to buy a spare battery
9.0|#|good Image quality|#|
5.0|#|very compact|#|picture quality not as I expected/ our old olympus 4mp cam can still beat it on shots that we've taken
7.0|#||#|I am missing a danish user menu in the camera.
8.0|#|I already have a Lumix Digital SLR camera but wanted one i could carry around all the time. The ZX1 has very similar controls and features including the IA (Inteligent Auto) and Lecia lenses. very happy with it so far.|#|I'm glad i've got finger nails the buttons are very small, but so is the camera so i supose you can't have it both ways.
10.0|#|Only had this camera two weeks so cannot really comment|#|
10.0|#|Very easy to use.  Good clear images and fast lagging speed.|#|
9.0|#|It does exactly what we want it to do.  Bought for ease of use and size.|#|
9.0|#|This camera is so easy to use and produces great results.The electronic zoom is a really usefull feature.|#|None
8.0|#|Simple to use, good quality lens/photos|#|No ability to 'autobracket' - ie. take mutliple photos at different exposures, but this is quite an advanced feature that perhaps you only expect on SLR cameras anyway
9.0|#||#|Bright light difficult tosee screen and focus photo
9.0|#|Picture quality is excellent, although it can't quite pick up some colour subtleties on the screen. Build quality is excellent and feels really solid. Plenty of features on offer.|#|Would be nice to have a case of some sort included even if it's just a cloth bag which could be used to clean the screen.
10.0|#|Very good image quality, and the auto functions make it quick and easy to get going. Some impressive features I haven't quite had the time to play with yet, e.g. it will recognise your friends faces and tag them in the file info. For the money this is easily the best camera I could have bought.|#|None
9.0|#|All in all it does everything I want and I enjoy using it.|#|Can't think of any!
10.0|#|Ease of use, compact,stylish.|#|The only downside as with most of todays digital cameras I miss a viewfinder particularly in the sunshine.
9.0|#|Easy to use. Good alround results.|#|none
9.0|#|It does everything it should better than i expected|#|In sunshine an eye viewer would be an advantage
10.0|#|Brillant lense. light weight, good video quality and great photos.|#|Haven't got to grips with all the camera's features yet-  need to read the manual , however for simple point and shoot photos it is easy to use.
10.0|#|Intelligent auto|#|none
9.0|#|sharp excellent results|#|Difficult to control zoom function, to rapid
9.0|#|Picture and Video quality is fantastic|#|
10.0|#|Turns on quickly, easy to focus and looks great|#|
8.0|#|Overall it's a great camera - nice and compact in comparison to it's newer version (which is a grade up).  I'm not clear how much the iA feature helps - maybe that's just me, a non-techie.|#|Not so good for spur of the moment shots as it doesn't load up fast enough and it doesn't capture the shot fast enough after you press the shutter release.  Far too many picture options - I'm sure some of them are the same as others.
10.0|#|Easy to use|#|None
8.0|#|I'd describe this as 'a poor man's Leica' but without the useful split-range viewfinder and (obviously) not the quality. But if you're looking for a compact camera that can give you better-than-compact performance, this is definitely the camera for you. The 20mm pancake lens is a must, and with its f1.7 aperture, you can finally have things pleasantly out of focus in a compact camera. The noise at anything higher than 200 ISO is I think a bit high, and dynamic range is not as good as a DSLR, obviously, but under the right conditions, it performs very well indeed. The price is a little high, I think, but the build quality certainly better than the Olympus Micro two-thirds. I bought an adaptor to take my old Nikon lenses which is a great feature, although focussing can be tricky, especially in sunlight - I aim to get the viewfinder accessory at some point. All in all a worthy addition to the camera bag. Small, light, high quality, and without the constraints of a heavy DSLR. Great fun.|#|Pricey, ISO gets noisy above 200 asa and dynamic range could be better. Lenses hugely expensive.
9.0|#|Light weight, selection of lenses and ease of use. Image stabilizer and optional external viewfinder.|#|External viewfinder is a little pricey
9.0|#|excellent image quality|#|no stabilizer on pancake lens
10.0|#|If your thinking of buying this camera then you probably already know a little about it already. Its the new mirrorless DSLR systems. This is not going to the job of a Canon 7D for example, but i do love it. I found myself using it more than i would my standard DSLR because its smaller and not so obtrusive. I really dislike carrying around a huge camera and then whipping it out to take a photo and drawing attention to yourself; i had no problems with this. The build quality is excellent and it feels really solid. I haven't looked at my images in detail yet, but so far they look great.|#|Battery doesn't seem to last as long as a traditional DSLR
8.0|#|Provides many features found on a DLSR but in a smaller body without the weight. An ideal back up camera / weekend camera. Autofocus is quicker than my Nikon DSLR. Was able to pick up and use very easily - have not yet ready the instructions and can use most functions. Buttons are well laid out and its great to have some manual controls /  dials as you would have expected on older cameras e.g. quick fire, timer settings rather than having to go through the camera menus. Build quality is good. Style reminds me of old rangefinder cameras which is welcomed. Perfect size / weight for easy use.|#|Video quality does not seem to be as good as with some DSLRs. Flash may be a little under-powered - shadows are seen around the edges of pictures.
9.0|#|Great Image Quality|#|Expensive
9.0|#|An excellent camera - virtually DSLR image quality in a compact package. The supplied 14-45mm kit lens is the perfect range for me and produces very good results. This camera is ideal when the weight and bulk of a bigger camera are too much hassle (I do a lot of mountain landscape photography and the GF1 is perfect for this) A full range of manual controls and RAW image output puts the user in full control. However, the auto options give good results if you just want to use it as a point and shoot. Build quality appears to be good too.|#|The only downside from my experience is that the screen can be hard to see on bright days. The optional viewfinder would help here, but it is expensive.
10.0|#|I love the fact that I can change lenses and with the 20mm you rarely need to use the flash for indoor shooting which means you get much more natuarl looking photos.|#|This is not for people who simply want a point and shoot as getting the most from this camera involves using the manual settings.  Flash is awful but I generally shoot without it even indoors particularly with the 20mm F1.7 lens.
9.0|#|saturated images from this lightweight easy to carry camera.|#|getting used to the various menus takes a little time but once you get the hang of it it becomes very easy.
9.0|#|very good screen|#|Noise at higher ISO speeds.
9.0|#|A great little camera when you don't want the weight of an SLR but do want the versatility of interchangeable lenses.|#|Would prefer the electronic viewfinder to be included as standard.
9.0|#|Camera body feels nice and solid. Menu system logical once you've spent a while going through the manual. Terrific autofocus speed. Nothing missing from the feature set - and using aperture-priority or programmed auto modes are really straightforward with rapid changes possible to all the key settings. Great image quality from the 14-45mm zoom lens too.|#|14-45mm lens a little on the bulky side compared with what I'd hope for - you'll still need to trate this smallish camera differently to a compact unless you shell out for the 20mm pancake lens too - so this means a proper camera bag, at which point the benefits over a bigger, heavier dSLR start to become marginal. Lens also feels a bit plasticky if you've been used to pre-digital-era high-quality optics. Popup flash also looks a bit flimsy, but this probably won't be an issue.
9.0|#|Excellent picture quality, comfortable to handle and use, and is of a decent build quality.|#|Interface could be a little easier to understand for novices.
9.0|#|Build quality|#|Video recording poor and grainy
8.0|#|Easy to use and takes excellent pictures except at night sometimes when the flash has a mind of its own. Also very good for taking movies with excellent sound quality. Otherwise it's a really good small camera which is pretty good value.|#|twice so people start to move after the first flash blurring your picture meaning you have to re-do some.
10.0|#|Ease of use. Good optical quality. Bargain.|#|You can catch some of the buttons on the back of the camera while your taking a picture - a minor niggle, as you do get used to it.
8.0|#|Pictures taken in normal mode are good.|#|AI mode sometimes blurs the picture, difficult capturing moving objects.
10.0|#|The best thing is the leica lense which undoubtely is the reason the quality of the images are so good.|#|
9.0|#|easy to use, takes good pictures, looks good, small and light|#|
9.0|#|after processing) is a boon for distributing to the friends and family of our four grandchildren.|#|The x4  telefoto is some times not man enough for a distant image - but acceptable given the dimensions of this super-small camera.
10.0|#|Great little camera, easy to use, has everything you  need for a family snapshot, cant fault it.|#|None, for the money its fantastic
9.0|#|A great well speced camera at a great price.|#|Small view screen.
10.0|#|Its a truly excellent little camera. I cant fault it|#|None that spring to mind
9.0|#|As above.  The movie application is very good for the occasional, and possibly unexpected, event.|#|may possibly be dangerous is very feeble indeed.  I have had  Panasonic cameras before and used after-market batteries with no problems whatsoever.
9.0|#|Ease of use|#|
9.0|#|Very easy to use and easy to print off photos . Lightweight and compact|#|Don!t know yet
10.0|#|A good all-round camera. Very easy to use.|#|No bad points. Panasonic always come up trumps.
10.0|#|EXCELENT CAMERA, very easy to use and handy to carry in pocket|#|It does't come with a semi-hard case, but these are cheap enough online.
9.0|#|This is a really well built, compact little camera; easy to pop in a pocket (but do use a soft bag to protect the screen).  Despite what I had read about the screen having a narrow angle of viewing I have found it very acceptable.  So far the screen has been easy to see but I have not yet tried it in brilliant sunlight.|#|stuff.  However the default settings have been fine so far.
10.0|#|It has everything you need to take great pictures - wide angle lens with 5X optical zoom (digital zoom is only really of use if you're using it to find things at a distance, it doesn't improve your picture any); 12M pixels; face detection; HD quality movies; and the intelligent auto button saves fiddling with modes if you're in a hurry.|#|Red eye correction doesn't really work but I've never known this to work well in cameras ever anyway - it's a feature of the subjects' eyes more than anything and it can be corrected when editing the shots; and the picture quality of the LCD screen isn't too brilliant when lining up shots, though is great for playback.
10.0|#|this little camera has so many features crammed in and it is so easy to use. I am not at all technically minded!  I am amazed at the quality of the pictures and I am constantly finding different features. (maybe because I didnt read the manual) Two friends have purchased similar models because of my recommendation.|#|There are none that I have found.
9.0|#|Great pictures from such a small camera and the wide angle lens is a bonus. Good to carry round when out walking as the SLR is too big and heavy so this is just ideal to capture things we would otherwise have missed.|#|Still getting used to much smaller controls!
10.0|#|purchased one for myself and another for my daughter as i was so impressed.|#|the leather lumix camera case should be included.
9.0|#|Really love this camera! It is easy to use and the picture quality is great. It is really quick from turning on to being able to take the first picture and also between shots.|#|Can't zoom when videoing but it is a camera and not a camcorder!
10.0|#|Image stability is excellent, never have a fuzzy picture even when taken on the move.  Lovely colour of camera body, makes it rather unique.  Good size, lightweight but excellent features and picture quality.|#|none
9.0|#|Much quicker to point and shoot than the three previous Panasonics that we've had.  Image quality is good although they seem to have done away with the Leica lens on this one.|#|The same old same old with these Panasonics and the reason that we've had four now (you'd have think we'd have learned by now) - the battery and memory card holder is still flimsy and still feels liable to break (as it has done before0.  You'll see the same point on most reviews I'd imagine.
9.0|#|Easy to use and fairly self-evident how everything works. Little need for the manual..|#|
10.0|#|A very easy to use camera.|#|
10.0|#|easy to use and good build quality|#|none
10.0|#|Excellent materials, really feels like you are holding something well-made and sturdy, I got the pink one so it looks cute too! The wrist strap that comes with it is really useful. All the settings are great, I probably use the 'Food' and the 'Pet' scene functions the most, as I'm a prolific baker and dog owner :)|#|The LCD screen on the back is a little difficult to see in bright natural light, but we don't exactly get much of that in the UK(!), so not really a big problem.
10.0|#|Good simple to use, automatic point and shoot, or plenty of features to select for best shot.|#|Have not found any yet.
9.0|#|GREAT EASY TO USE LIGHT CAMERA|#|NONE SO FAR
9.0|#|Easy to use, camera looks more expensive than it is, great Lumix lens which is more important than number of pixels. For the price it is a bargain! The Lumix lens is the only reason I bought it.|#|I thought the 720p HD video would give better results....it's not too bad though....but I guess the camera's primary function is to take great photos, not video....HD video is secondary.....if you want great HD video then buy a dedicated HD camcorder costing a lot more money :)
9.0|#|quick between shots.|#|
9.0|#|Camera is really easy to use, takes good photos, macro shots especially, has lots of different modes to get the picture exactly how you want it. Really good value for money.|#|I would have liked to be able to vary the shutter speed, the only way to do it is to use the starry sky mode which you can't use in the day or it kind of blinds the camera because daytime light is too bright.
10.0|#|small enough to go in a small handbag, good quality, easy to use and pretty!|#|so far i have found no bad things
9.0|#|A good looking, easy to use compact camera with excellent features.   It does everything I want|#|I can't think of any worthy of mention
7.0|#|Slim, lightweight.|#|The on/off switch is easy to accidentally knock on when putting in the camera case causing the lens to open inside the case.
6.0|#|Photos are pretty good for what is essentially a point and click - so I can't be too unhappy.|#|!!
9.0|#|and the picture quality is very good.|#|None so far.
9.0|#|Effective image stabilisation.|#|None, really, for a camera of this price.
9.0|#|Easy to use, excellent picture quality, battery life good, easy to upload photos onto PC, really like it a lot|#|None
9.0|#|compact easy to use good picture quality|#|build quality could be better
9.0|#|very good value|#|no optical viewfinder
9.0|#|great easy to use camera|#|none
8.0|#|A good value for money first camera. Very compact and easy to use.|#|and lack sharpness in some situations, but then again you are not paying top dollar price.
9.0|#|Very easy to use|#|None so far
10.0|#|Perfect camera for popping un your bag and taking out with you. Excellent picture quality, both wide scenic and people close up.|#|None obvious so far
9.0|#|light... does the job|#|Biit slippy to hold
9.0|#|Very thin  and compact, you hardly notice it in your pocket - just what we wanted.. Nice and easy to use but with loads of optional modes and features for a small camera, most which look like they'll be useful at some time.  Starts up quickly and takes very acceptable photos and HD video without fuss. Made a neat pouch for it from an old Specsavers glasses case - cost zero  except a few minutes time with scissors and sewing machine.|#|Downloading from the camera can be painfully slow at under 1mb/sec which can take ages especially if you have some HD video at 4mb/sec. so recommend getting an SDHC card reader for a few pounds which is around 10 times faster.
9.0|#|Does what it says on the box.|#|The software is not as good as one I already use. But it would be fine if you did not have alternative photo software.
9.0|#|Value for money,Easy to use - put it on intelligent auto and take your pics - brilliant.|#|None
9.0|#|Great value camera. I'm not an expert but have had several digital cameras and for the money it's amasing. Quality photos and feels good too. Girlfriend now about to get one also. Had comments on trip to Italy from people saying 'nice camera'. Buy the 16gb memory card, tho, as 12 megs does east into the memory especially if taking movies.|#|The camera is slow to start up. You have to wait a couple of extra seconds to wait for the words 'normal picture' to show before you can take a photo or zoom. Also, the image is lost in bright light.
9.0|#|Picture quality is extremely good (considering it is essentially a low cost compact).  Very easy to set up and use, works very well on intelligent auto, you won't be disappointed!.  Highly recommended.|#|None.
10.0|#|Fantastic camera for this price. Easy to use and great image quality.|#|
9.0|#|Nice fit in the pocket, point and shoot, Nice sized screen, Battery recharge is quick, and I think Photo quality is excellent|#|The only extra thing I could want would be A panoramic feature - but that a bit nit picking?
8.0|#|Great point and shoot camera, excellent in low light situations. Feels well made and is easy to use. If you want a camera that you dont have to faff with and rely on it to take great shoots then this is perfect.|#|None thus far.
10.0|#|video quality is good too,  it also has a larger screen, 2.7ins.  Put together with a 4gb sdhc card , it is a great little put in your pocket  camera.|#|If the camera is in constant use together with video maybe the larger size battery would be a better option.
10.0|#|Great litle compact camera, Great feel to it, I read all the reviews on this camera before i purchased one and i havent been disappointed. I would highly recommend this camera.   :-)|#|
9.0|#|So easy to use, you don't have to be a rocket scientist to use like some others. I'm a bit short sighted but once you know where all the controls are its no problem.|#|Haven't found them yet.
9.0|#|Compact, great picture quality, fast picture shots|#|no panoramic mode
10.0|#|Such a lovely little compact camera which can fit into your pocket and so easy to use. I would definitly recommend this camera to anyone.|#|Only downside was that it didnt come with a case. Had to purchase it separately.
8.0|#|As indicated within the scores the camera easy to use and produces an excellent quality of image. I am particularly pleased with its compact build and size. I shall recommend it to my friends.|#|
9.0|#|Very small and therefore easy to carry around. Takes good pictures.|#|Movie mode not as good as I had anticpated given that it was HD.
10.0|#|Good...easy to setup, use and great pic quality....|#|Bad...bought it for somebody else so dont get to use it!
9.0|#|Li-on re-chargeable battery.|#|Battery has to be removed to charge via ecxternal charger.
9.0|#|Easy to use and high quality results. Excellent lens. Battery charge lasts for ages.|#|You have to take the battery out to charge it. Flap of battery compartment and catch don't look very strong.
10.0|#|High quality photos and videos,easy to use,lots of different features.|#|Not really a bad point,but the camera is very fragile so requires a case for sure.
9.0|#||#|Screen doesn't cope with the sun well, however this doesn't translate to the picture quality which is excellent
8.0|#|Easy to use|#|None so far
9.0|#|Either select pre-set exposure settings per environment, fiddle with settings or just leave on the automatic setting as per many other point and shoot cameras. Lightweight,looks good in black and nice roomy screen.  Zoom in out with ease as this is incorporated as a swivel arm into the exposure button.  All in all a good camera which takes good pictures.|#|
9.0|#|Well made and intuitive to use. Lots of choices about picture format and quality are available. Used it extensively on my last holiday abroad and found it to be excellent. The Intelligent Auto Function made taking good photographs easy. Found that the ability to put the 'Rule of Thirds' grid on screen made composing landscape scenes that much easier and led to better looking photographs. Fantastic camera for the price that I paid.|#|Minor point. Zoom not available in video mode.
10.0|#|Fatastic camera, great picture quality (exposure preview is a great feature), scene modes are good, pretty quick, and has already survived a very active holiday where we were using it all the time. Battery life is good and quick to charge. Great value for money.|#|a little grainey at night without flash, but that's to be expected really!
8.0|#|Nice looking camera, BUT and its a big BUTTT. When veiwing at the screen to take a photo the scree has a blue haze over the image, it can be screen wide or in thick bars. The product will have to go back and be replaced, I will not accept a repair on what should be a perfect and duly inspected item.|#|As above, it should never have left the factory in such a condition
8.0|#|Photo quality is very good, lots of different settings for different types of photos - portraits, scenery etc.|#|takes a very long time to upload photos onto computer
8.0|#|Very easy to use and set up.|#|Auto focus not so good some pictures on zoom very blurred
8.0|#|Light weight and compact. Good quality zoom.|#|Not as high quality as the TZ range. Also it is not as easy to swithc between different settings as some other cameras.
10.0|#|So easy, and set on Auto you just need to point and press, in any light all pics are good. Excellent camer|#|none
7.0|#||#|Personally, I didn't like the manual switch which toggles between record and playback modes. Would have preferred a 'play' button with a half-depress of the shutter to automatically switch back to record more: the manual switch I think is a little bit fiddly for podgey fingers!
8.0|#|Good quality pictures, good battery life, compact, easy to use for basic picture taking|#|More complex if more in depth controls for taking pictures are required
9.0|#||#|Otherwise, there are no major issues with the camera.
7.0|#|it is perfectly satisfactory|#|none that we have encountered
9.0|#|Easy to use and good value for money.|#|Although we contacted Panasonic technical pre sales we weren't advised that by buying the next model up we could have had the facility to buy a blu ray dvd burner  which would have allowed us to produce blu ray dvds now. This model doesnt have that.
9.0|#|Image quality, easy to use, useful features but not over the top. Good automatic with reasonable choice of user selectable options.|#|No viewfinder
9.0|#|Clarity of pictures|#|Didnt realise it was a re-chargeable battery!
9.0|#|I really like this camera. It's really easy to use and I have hardly had to look at the instructions. The image quality is excellent and the shutter lag is very short, needed for photographing my toddler!|#|I really can't of anything apart from it' not that clear how to get pictures from the internal memory but I have had that problem with compact cameras before.
9.0|#|Baby/children and pet naming features are fantastic, never have to worry about working out how old your child was in 'that' picture!|#|
8.0|#|Size, weight, storage on SDHC up to 32GB. stabilsation, battery life|#|No soft case , no memory card provided
10.0|#|Nice little camera. Have not taken many photos yet, but test photos look good. Very Good value for money.|#|None
10.0|#|easy to use|#|
10.0|#|it was a present for my daughter who is finding it easy to use and great results|#|
9.0|#|More or less idiot proof, easy to use|#|Nothing
